MATCHUP,GAME_ID,SEASON,GAME_DATE,HOME_TEAM_NICKNAME,HOME_TEAM_ID,AWAY_TEAM_NICKNAME,AWAY_TEAM_ID
04/10/2018 76ers at Hawks,0021701214,2017-18,2018-04-10, Hawks,1610612737, 76ers,1610612755
04/08/2018 Hawks at Celtics,0021701202,2017-18,2018-04-08, Celtics,1610612738, Hawks,1610612737
04/06/2018 Hawks at Wizards,0021701184,2017-18,2018-04-06, Wizards,1610612764, Hawks,1610612737
04/04/2018 Heat at Hawks,0021701172,2017-18,2018-04-04, Hawks,1610612737, Heat,1610612748
04/03/2018 Hawks at Heat,0021701158,2017-18,2018-04-03, Heat,1610612748, Hawks,1610612737
04/01/2018 Magic at Hawks,0021701147,2017-18,2018-04-01, Hawks,1610612737, Magic,1610612753
03/30/2018 76ers at Hawks,0021701130,2017-18,2018-03-30, Hawks,1610612737, 76ers,1610612755
03/28/2018 Hawks at Timberwolves,0021701120,2017-18,2018-03-28, Timberwolves,1610612750, Hawks,1610612737
03/25/2018 Hawks at Rockets,0021701101,2017-18,2018-03-25, Rockets,1610612745, Hawks,1610612737
03/23/2018 Hawks at Warriors,0021701087,2017-18,2018-03-23, Warriors,1610612744, Hawks,1610612737
03/22/2018 Hawks at Kings,0021701077,2017-18,2018-03-22, Kings,1610612758, Hawks,1610612737
03/20/2018 Hawks at Jazz,0021701062,2017-18,2018-03-20, Jazz,1610612762, Hawks,1610612737
03/17/2018 Hawks at Bucks,0021701041,2017-18,2018-03-17, Bucks,1610612749, Hawks,1610612737
03/15/2018 Hornets at Hawks,0021701021,2017-18,2018-03-15, Hawks,1610612737, Hornets,1610612766
03/13/2018 Thunder at Hawks,0021701007,2017-18,2018-03-13, Hawks,1610612737, Thunder,1610612760
03/11/2018 Bulls at Hawks,0021700993,2017-18,2018-03-11, Hawks,1610612737, Bulls,1610612741
03/09/2018 Hawks at Pacers,0021700978,2017-18,2018-03-09, Pacers,1610612754, Hawks,1610612737
03/06/2018 Hawks at Raptors,0021700958,2017-18,2018-03-06, Raptors,1610612761, Hawks,1610612737
03/04/2018 Suns at Hawks,0021700943,2017-18,2018-03-04, Hawks,1610612737, Suns,1610612756
03/02/2018 Warriors at Hawks,0021700928,2017-18,2018-03-02, Hawks,1610612737, Warriors,1610612744
02/28/2018 Pacers at Hawks,0021700915,2017-18,2018-02-28, Hawks,1610612737, Pacers,1610612754
02/26/2018 Lakers at Hawks,0021700897,2017-18,2018-02-26, Hawks,1610612737, Lakers,1610612747
02/23/2018 Hawks at Pacers,0021700874,2017-18,2018-02-23, Pacers,1610612754, Hawks,1610612737
02/14/2018 Hawks at Pistons,0021700853,2017-18,2018-02-14, Pistons,1610612765, Hawks,1610612737
02/13/2018 Hawks at Bucks,0021700848,2017-18,2018-02-13, Bucks,1610612749, Hawks,1610612737
02/11/2018 Pistons at Hawks,0021700834,2017-18,2018-02-11, Hawks,1610612737, Pistons,1610612765
02/09/2018 Cavaliers at Hawks,0021700819,2017-18,2018-02-09, Hawks,1610612737, Cavaliers,1610612739
02/08/2018 Hawks at Magic,0021700811,2017-18,2018-02-08, Magic,1610612753, Hawks,1610612737
02/06/2018 Grizzlies at Hawks,0021700799,2017-18,2018-02-06, Hawks,1610612737, Grizzlies,1610612763
02/04/2018 Hawks at Knicks,0021700786,2017-18,2018-02-04, Knicks,1610612752, Hawks,1610612737
02/02/2018 Hawks at Celtics,0021700767,2017-18,2018-02-02, Celtics,1610612738, Hawks,1610612737
01/31/2018 Hornets at Hawks,0021700755,2017-18,2018-01-31, Hawks,1610612737, Hornets,1610612766
01/29/2018 Timberwolves at Hawks,0021700739,2017-18,2018-01-29, Hawks,1610612737, Timberwolves,1610612750
01/27/2018 Wizards at Hawks,0021700726,2017-18,2018-01-27, Hawks,1610612737, Wizards,1610612764
01/26/2018 Hawks at Hornets,0021700714,2017-18,2018-01-26, Hornets,1610612766, Hawks,1610612737
01/24/2018 Raptors at Hawks,0021700705,2017-18,2018-01-24, Hawks,1610612737, Raptors,1610612761
01/22/2018 Jazz at Hawks,0021700688,2017-18,2018-01-22, Hawks,1610612737, Jazz,1610612762
01/20/2018 Bulls at Hawks,0021700675,2017-18,2018-01-20, Hawks,1610612737, Bulls,1610612741
01/17/2018 Pelicans at Hawks,0021700654,2017-18,2018-01-17, Hawks,1610612737, Pelicans,1610612740
01/15/2018 Spurs at Hawks,0021700641,2017-18,2018-01-15, Hawks,1610612737, Spurs,1610612759
01/12/2018 Nets at Hawks,0021700621,2017-18,2018-01-12, Hawks,1610612737, Nets,1610612751
01/10/2018 Hawks at Nuggets,0021700612,2017-18,2018-01-10, Nuggets,1610612743, Hawks,1610612737
01/08/2018 Hawks at Clippers,0021700598,2017-18,2018-01-08, Clippers,1610612746, Hawks,1610612737
01/07/2018 Hawks at Lakers,0021700590,2017-18,2018-01-07, Lakers,1610612747, Hawks,1610612737
01/05/2018 Hawks at Trail Blazers,0021700576,2017-18,2018-01-05, Trail Blazers,1610612757, Hawks,1610612737
01/02/2018 Hawks at Suns,0021700551,2017-18,2018-01-02, Suns,1610612756, Hawks,1610612737
12/30/2017 Trail Blazers at Hawks,0021700533,2017-18,2017-12-30, Hawks,1610612737, Trail Blazers,1610612757
12/29/2017 Hawks at Raptors,0021700522,2017-18,2017-12-29, Raptors,1610612761, Hawks,1610612737
12/27/2017 Wizards at Hawks,0021700508,2017-18,2017-12-27, Hawks,1610612737, Wizards,1610612764
12/23/2017 Mavericks at Hawks,0021700484,2017-18,2017-12-23, Hawks,1610612737, Mavericks,1610612742
12/22/2017 Hawks at Thunder,0021700477,2017-18,2017-12-22, Thunder,1610612760, Hawks,1610612737
12/20/2017 Pacers at Hawks,0021700455,2017-18,2017-12-20, Hawks,1610612737, Pacers,1610612754
12/18/2017 Heat at Hawks,0021700443,2017-18,2017-12-18, Hawks,1610612737, Heat,1610612748
12/15/2017 Hawks at Grizzlies,0021700425,2017-18,2017-12-15, Grizzlies,1610612763, Hawks,1610612737
12/14/2017 Pistons at Hawks,0021700413,2017-18,2017-12-14, Hawks,1610612737, Pistons,1610612765
12/12/2017 Hawks at Cavaliers,0021700397,2017-18,2017-12-12, Cavaliers,1610612739, Hawks,1610612737
12/10/2017 Hawks at Knicks,0021700390,2017-18,2017-12-10, Knicks,1610612752, Hawks,1610612737
12/09/2017 Magic at Hawks,0021700378,2017-18,2017-12-09, Hawks,1610612737, Magic,1610612753
12/06/2017 Hawks at Magic,0021700355,2017-18,2017-12-06, Magic,1610612753, Hawks,1610612737
12/04/2017 Nets at Hawks,0021700342,2017-18,2017-12-04, Hawks,1610612737, Nets,1610612751
12/02/2017 Hawks at Nets,0021700328,2017-18,2017-12-02, Nets,1610612751, Hawks,1610612737
11/30/2017 Cavaliers at Hawks,0021700313,2017-18,2017-11-30, Hawks,1610612737, Cavaliers,1610612739
11/25/2017 Raptors at Hawks,0021700280,2017-18,2017-11-25, Hawks,1610612737, Raptors,1610612761
11/24/2017 Knicks at Hawks,0021700268,2017-18,2017-11-24, Hawks,1610612737, Knicks,1610612752
11/22/2017 Clippers at Hawks,0021700256,2017-18,2017-11-22, Hawks,1610612737, Clippers,1610612746
11/20/2017 Hawks at Spurs,0021700250,2017-18,2017-11-20, Spurs,1610612759, Hawks,1610612737
11/18/2017 Celtics at Hawks,0021700230,2017-18,2017-11-18, Hawks,1610612737, Celtics,1610612738
11/15/2017 Kings at Hawks,0021700204,2017-18,2017-11-15, Hawks,1610612737, Kings,1610612758
11/13/2017 Hawks at Pelicans,0021700195,2017-18,2017-11-13, Pelicans,1610612740, Hawks,1610612737
11/11/2017 Hawks at Wizards,0021700177,2017-18,2017-11-11, Wizards,1610612764, Hawks,1610612737
11/10/2017 Hawks at Pistons,0021700169,2017-18,2017-11-10, Pistons,1610612765, Hawks,1610612737
11/06/2017 Celtics at Hawks,0021700146,2017-18,2017-11-06, Hawks,1610612737, Celtics,1610612738
11/05/2017 Hawks at Cavaliers,0021700136,2017-18,2017-11-05, Cavaliers,1610612739, Hawks,1610612737
11/03/2017 Rockets at Hawks,0021700123,2017-18,2017-11-03, Hawks,1610612737, Rockets,1610612745
11/01/2017 Hawks at 76ers,0021700107,2017-18,2017-11-01, 76ers,1610612755, Hawks,1610612737
10/29/2017 Bucks at Hawks,0021700085,2017-18,2017-10-29, Hawks,1610612737, Bucks,1610612749
10/27/2017 Nuggets at Hawks,0021700072,2017-18,2017-10-27, Hawks,1610612737, Nuggets,1610612743
10/26/2017 Hawks at Bulls,0021700065,2017-18,2017-10-26, Bulls,1610612741, Hawks,1610612737
10/23/2017 Hawks at Heat,0021700042,2017-18,2017-10-23, Heat,1610612748, Hawks,1610612737
10/22/2017 Hawks at Nets,0021700038,2017-18,2017-10-22, Nets,1610612751, Hawks,1610612737
10/20/2017 Hawks at Hornets,0021700017,2017-18,2017-10-20, Hornets,1610612766, Hawks,1610612737
10/18/2017 Hawks at Mavericks,0021700009,2017-18,2017-10-18, Mavericks,1610612742, Hawks,1610612737
04/11/2018 Nets at Celtics,0021701219,2017-18,2018-04-11, Celtics,1610612738, Nets,1610612751
04/10/2018 Celtics at Wizards,0021701215,2017-18,2018-04-10, Wizards,1610612764, Celtics,1610612738
04/06/2018 Bulls at Celtics,0021701185,2017-18,2018-04-06, Celtics,1610612738, Bulls,1610612741
04/04/2018 Celtics at Raptors,0021701171,2017-18,2018-04-04, Raptors,1610612761, Celtics,1610612738
04/03/2018 Celtics at Bucks,0021701162,2017-18,2018-04-03, Bucks,1610612749, Celtics,1610612738
03/31/2018 Raptors at Celtics,0021701140,2017-18,2018-03-31, Celtics,1610612738, Raptors,1610612761
03/28/2018 Celtics at Jazz,0021701121,2017-18,2018-03-28, Jazz,1610612762, Celtics,1610612738
03/26/2018 Celtics at Suns,0021701107,2017-18,2018-03-26, Suns,1610612756, Celtics,1610612738
03/25/2018 Celtics at Kings,0021701099,2017-18,2018-03-25, Kings,1610612758, Celtics,1610612738
03/23/2018 Celtics at Trail Blazers,0021701086,2017-18,2018-03-23, Trail Blazers,1610612757, Celtics,1610612738
03/20/2018 Thunder at Celtics,0021701059,2017-18,2018-03-20, Celtics,1610612738, Thunder,1610612760
03/18/2018 Celtics at Pelicans,0021701047,2017-18,2018-03-18, Pelicans,1610612740, Celtics,1610612738
03/16/2018 Celtics at Magic,0021701029,2017-18,2018-03-16, Magic,1610612753, Celtics,1610612738
03/14/2018 Wizards at Celtics,0021701017,2017-18,2018-03-14, Celtics,1610612738, Wizards,1610612764
03/11/2018 Pacers at Celtics,0021700998,2017-18,2018-03-11, Celtics,1610612738, Pacers,1610612754
03/08/2018 Celtics at Timberwolves,0021700974,2017-18,2018-03-08, Timberwolves,1610612750, Celtics,1610612738
03/05/2018 Celtics at Bulls,0021700953,2017-18,2018-03-05, Bulls,1610612741, Celtics,1610612738
03/03/2018 Celtics at Rockets,0021700939,2017-18,2018-03-03, Rockets,1610612745, Celtics,1610612738
02/28/2018 Hornets at Celtics,0021700916,2017-18,2018-02-28, Celtics,1610612738, Hornets,1610612766
02/26/2018 Grizzlies at Celtics,0021700898,2017-18,2018-02-26, Celtics,1610612738, Grizzlies,1610612763
02/24/2018 Celtics at Knicks,0021700886,2017-18,2018-02-24, Knicks,1610612752, Celtics,1610612738
02/23/2018 Celtics at Pistons,0021700873,2017-18,2018-02-23, Pistons,1610612765, Celtics,1610612738
02/14/2018 Clippers at Celtics,0021700858,2017-18,2018-02-14, Celtics,1610612738, Clippers,1610612746
02/11/2018 Cavaliers at Celtics,0021700835,2017-18,2018-02-11, Celtics,1610612738, Cavaliers,1610612739
02/09/2018 Pacers at Celtics,0021700820,2017-18,2018-02-09, Celtics,1610612738, Pacers,1610612754
02/08/2018 Celtics at Wizards,0021700813,2017-18,2018-02-08, Wizards,1610612764, Celtics,1610612738
02/06/2018 Celtics at Raptors,0021700798,2017-18,2018-02-06, Raptors,1610612761, Celtics,1610612738
02/04/2018 Trail Blazers at Celtics,0021700784,2017-18,2018-02-04, Celtics,1610612738, Trail Blazers,1610612757
01/31/2018 Knicks at Celtics,0021700758,2017-18,2018-01-31, Celtics,1610612738, Knicks,1610612752
01/29/2018 Celtics at Nuggets,0021700743,2017-18,2018-01-29, Nuggets,1610612743, Celtics,1610612738
01/27/2018 Celtics at Warriors,0021700728,2017-18,2018-01-27, Warriors,1610612744, Celtics,1610612738
01/24/2018 Celtics at Clippers,0021700709,2017-18,2018-01-24, Clippers,1610612746, Celtics,1610612738
01/23/2018 Celtics at Lakers,0021700700,2017-18,2018-01-23, Lakers,1610612747, Celtics,1610612738
01/21/2018 Magic at Celtics,0021700683,2017-18,2018-01-21, Celtics,1610612738, Magic,1610612753
01/18/2018 76ers at Celtics,0021700663,2017-18,2018-01-18, Celtics,1610612738, 76ers,1610612755
01/16/2018 Pelicans at Celtics,0021700650,2017-18,2018-01-16, Celtics,1610612738, Pelicans,1610612740
01/11/2018 Celtics at 76ers,0021700614,2017-18,2018-01-11, 76ers,1610612755, Celtics,1610612738
01/06/2018 Celtics at Nets,0021700579,2017-18,2018-01-06, Nets,1610612751, Celtics,1610612738
01/05/2018 Timberwolves at Celtics,0021700570,2017-18,2018-01-05, Celtics,1610612738, Timberwolves,1610612750
01/03/2018 Cavaliers at Celtics,0021700559,2017-18,2018-01-03, Celtics,1610612738, Cavaliers,1610612739
12/31/2017 Nets at Celtics,0021700539,2017-18,2017-12-31, Celtics,1610612738, Nets,1610612751
12/28/2017 Rockets at Celtics,0021700517,2017-18,2017-12-28, Celtics,1610612738, Rockets,1610612745
12/27/2017 Celtics at Hornets,0021700506,2017-18,2017-12-27, Hornets,1610612766, Celtics,1610612738
12/25/2017 Wizards at Celtics,0021700495,2017-18,2017-12-25, Celtics,1610612738, Wizards,1610612764
12/23/2017 Bulls at Celtics,0021700485,2017-18,2017-12-23, Celtics,1610612738, Bulls,1610612741
12/21/2017 Celtics at Knicks,0021700468,2017-18,2017-12-21, Knicks,1610612752, Celtics,1610612738
12/20/2017 Heat at Celtics,0021700456,2017-18,2017-12-20, Celtics,1610612738, Heat,1610612748
12/18/2017 Celtics at Pacers,0021700442,2017-18,2017-12-18, Pacers,1610612754, Celtics,1610612738
12/16/2017 Celtics at Grizzlies,0021700436,2017-18,2017-12-16, Grizzlies,1610612763, Celtics,1610612738
12/15/2017 Jazz at Celtics,0021700423,2017-18,2017-12-15, Celtics,1610612738, Jazz,1610612762
12/13/2017 Nuggets at Celtics,0021700407,2017-18,2017-12-13, Celtics,1610612738, Nuggets,1610612743
12/11/2017 Celtics at Bulls,0021700391,2017-18,2017-12-11, Bulls,1610612741, Celtics,1610612738
12/10/2017 Celtics at Pistons,0021700386,2017-18,2017-12-10, Pistons,1610612765, Celtics,1610612738
12/08/2017 Celtics at Spurs,0021700374,2017-18,2017-12-08, Spurs,1610612759, Celtics,1610612738
12/06/2017 Mavericks at Celtics,0021700356,2017-18,2017-12-06, Celtics,1610612738, Mavericks,1610612742
12/04/2017 Bucks at Celtics,0021700343,2017-18,2017-12-04, Celtics,1610612738, Bucks,1610612749
12/02/2017 Suns at Celtics,0021700326,2017-18,2017-12-02, Celtics,1610612738, Suns,1610612756
11/30/2017 76ers at Celtics,0021700314,2017-18,2017-11-30, Celtics,1610612738, 76ers,1610612755
11/27/2017 Pistons at Celtics,0021700292,2017-18,2017-11-27, Celtics,1610612738, Pistons,1610612765
11/25/2017 Celtics at Pacers,0021700281,2017-18,2017-11-25, Pacers,1610612754, Celtics,1610612738
11/24/2017 Magic at Celtics,0021700269,2017-18,2017-11-24, Celtics,1610612738, Magic,1610612753
11/22/2017 Celtics at Heat,0021700257,2017-18,2017-11-22, Heat,1610612748, Celtics,1610612738
11/20/2017 Celtics at Mavericks,0021700249,2017-18,2017-11-20, Mavericks,1610612742, Celtics,1610612738
11/16/2017 Warriors at Celtics,0021700215,2017-18,2017-11-16, Celtics,1610612738, Warriors,1610612744
11/14/2017 Celtics at Nets,0021700201,2017-18,2017-11-14, Nets,1610612751, Celtics,1610612738
11/12/2017 Raptors at Celtics,0021700188,2017-18,2017-11-12, Celtics,1610612738, Raptors,1610612761
11/10/2017 Hornets at Celtics,0021700170,2017-18,2017-11-10, Celtics,1610612738, Hornets,1610612766
11/08/2017 Lakers at Celtics,0021700161,2017-18,2017-11-08, Celtics,1610612738, Lakers,1610612747
11/05/2017 Celtics at Magic,0021700138,2017-18,2017-11-05, Magic,1610612753, Celtics,1610612738
11/03/2017 Celtics at Thunder,0021700129,2017-18,2017-11-03, Thunder,1610612760, Celtics,1610612738
11/01/2017 Kings at Celtics,0021700109,2017-18,2017-11-01, Celtics,1610612738, Kings,1610612758
10/30/2017 Spurs at Celtics,0021700092,2017-18,2017-10-30, Celtics,1610612738, Spurs,1610612759
10/28/2017 Celtics at Heat,0021700078,2017-18,2017-10-28, Heat,1610612748, Celtics,1610612738
10/26/2017 Celtics at Bucks,0021700067,2017-18,2017-10-26, Bucks,1610612749, Celtics,1610612738
10/24/2017 Knicks at Celtics,0021700051,2017-18,2017-10-24, Celtics,1610612738, Knicks,1610612752
10/20/2017 Celtics at 76ers,0021700019,2017-18,2017-10-20, 76ers,1610612755, Celtics,1610612738
10/18/2017 Bucks at Celtics,0021700007,2017-18,2017-10-18, Celtics,1610612738, Bucks,1610612749
10/17/2017 Celtics at Cavaliers,0021700001,2017-18,2017-10-17, Cavaliers,1610612739, Celtics,1610612738
04/11/2018 Knicks at Cavaliers,0021701220,2017-18,2018-04-11, Cavaliers,1610612739, Knicks,1610612752
04/09/2018 Cavaliers at Knicks,0021701207,2017-18,2018-04-09, Knicks,1610612752, Cavaliers,1610612739
04/06/2018 Cavaliers at 76ers,0021701183,2017-18,2018-04-06, 76ers,1610612755, Cavaliers,1610612739
04/05/2018 Wizards at Cavaliers,0021701176,2017-18,2018-04-05, Cavaliers,1610612739, Wizards,1610612764
04/03/2018 Raptors at Cavaliers,0021701156,2017-18,2018-04-03, Cavaliers,1610612739, Raptors,1610612761
04/01/2018 Mavericks at Cavaliers,0021701149,2017-18,2018-04-01, Cavaliers,1610612739, Mavericks,1610612742
03/30/2018 Pelicans at Cavaliers,0021701131,2017-18,2018-03-30, Cavaliers,1610612739, Pelicans,1610612740
03/28/2018 Cavaliers at Hornets,0021701116,2017-18,2018-03-28, Hornets,1610612766, Cavaliers,1610612739
03/27/2018 Cavaliers at Heat,0021701110,2017-18,2018-03-27, Heat,1610612748, Cavaliers,1610612739
03/25/2018 Cavaliers at Nets,0021701094,2017-18,2018-03-25, Nets,1610612751, Cavaliers,1610612739
03/23/2018 Suns at Cavaliers,0021701080,2017-18,2018-03-23, Cavaliers,1610612739, Suns,1610612756
03/21/2018 Raptors at Cavaliers,0021701065,2017-18,2018-03-21, Cavaliers,1610612739, Raptors,1610612761
03/19/2018 Bucks at Cavaliers,0021701050,2017-18,2018-03-19, Cavaliers,1610612739, Bucks,1610612749
03/17/2018 Cavaliers at Bulls,0021701039,2017-18,2018-03-17, Bulls,1610612741, Cavaliers,1610612739
03/15/2018 Cavaliers at Trail Blazers,0021701028,2017-18,2018-03-15, Trail Blazers,1610612757, Cavaliers,1610612739
03/13/2018 Cavaliers at Suns,0021701014,2017-18,2018-03-13, Suns,1610612756, Cavaliers,1610612739
03/11/2018 Cavaliers at Lakers,0021701000,2017-18,2018-03-11, Lakers,1610612747, Cavaliers,1610612739
03/09/2018 Cavaliers at Clippers,0021700986,2017-18,2018-03-09, Clippers,1610612746, Cavaliers,1610612739
03/07/2018 Cavaliers at Nuggets,0021700970,2017-18,2018-03-07, Nuggets,1610612743, Cavaliers,1610612739
03/05/2018 Pistons at Cavaliers,0021700950,2017-18,2018-03-05, Cavaliers,1610612739, Pistons,1610612765
03/03/2018 Nuggets at Cavaliers,0021700937,2017-18,2018-03-03, Cavaliers,1610612739, Nuggets,1610612743
03/01/2018 76ers at Cavaliers,0021700923,2017-18,2018-03-01, Cavaliers,1610612739, 76ers,1610612755
02/27/2018 Nets at Cavaliers,0021700908,2017-18,2018-02-27, Cavaliers,1610612739, Nets,1610612751
02/25/2018 Spurs at Cavaliers,0021700894,2017-18,2018-02-25, Cavaliers,1610612739, Spurs,1610612759
02/23/2018 Cavaliers at Grizzlies,0021700878,2017-18,2018-02-23, Grizzlies,1610612763, Cavaliers,1610612739
02/22/2018 Wizards at Cavaliers,0021700869,2017-18,2018-02-22, Cavaliers,1610612739, Wizards,1610612764
02/13/2018 Cavaliers at Thunder,0021700850,2017-18,2018-02-13, Thunder,1610612760, Cavaliers,1610612739
02/07/2018 Timberwolves at Cavaliers,0021700807,2017-18,2018-02-07, Cavaliers,1610612739, Timberwolves,1610612750
02/06/2018 Cavaliers at Magic,0021700797,2017-18,2018-02-06, Magic,1610612753, Cavaliers,1610612739
02/03/2018 Rockets at Cavaliers,0021700779,2017-18,2018-02-03, Cavaliers,1610612739, Rockets,1610612745
01/31/2018 Heat at Cavaliers,0021700757,2017-18,2018-01-31, Cavaliers,1610612739, Heat,1610612748
01/30/2018 Cavaliers at Pistons,0021700747,2017-18,2018-01-30, Pistons,1610612765, Cavaliers,1610612739
01/28/2018 Pistons at Cavaliers,0021700734,2017-18,2018-01-28, Cavaliers,1610612739, Pistons,1610612765
01/26/2018 Pacers at Cavaliers,0021700715,2017-18,2018-01-26, Cavaliers,1610612739, Pacers,1610612754
01/23/2018 Cavaliers at Spurs,0021700698,2017-18,2018-01-23, Spurs,1610612759, Cavaliers,1610612739
01/20/2018 Thunder at Cavaliers,0021700674,2017-18,2018-01-20, Cavaliers,1610612739, Thunder,1610612760
01/18/2018 Magic at Cavaliers,0021700664,2017-18,2018-01-18, Cavaliers,1610612739, Magic,1610612753
01/15/2018 Warriors at Cavaliers,0021700646,2017-18,2018-01-15, Cavaliers,1610612739, Warriors,1610612744
01/12/2018 Cavaliers at Pacers,0021700619,2017-18,2018-01-12, Pacers,1610612754, Cavaliers,1610612739
01/11/2018 Cavaliers at Raptors,0021700615,2017-18,2018-01-11, Raptors,1610612761, Cavaliers,1610612739
01/08/2018 Cavaliers at Timberwolves,0021700594,2017-18,2018-01-08, Timberwolves,1610612750, Cavaliers,1610612739
01/06/2018 Cavaliers at Magic,0021700582,2017-18,2018-01-06, Magic,1610612753, Cavaliers,1610612739
01/02/2018 Trail Blazers at Cavaliers,0021700549,2017-18,2018-01-02, Cavaliers,1610612739, Trail Blazers,1610612757
12/30/2017 Cavaliers at Jazz,0021700534,2017-18,2017-12-30, Jazz,1610612762, Cavaliers,1610612739
12/27/2017 Cavaliers at Kings,0021700513,2017-18,2017-12-27, Kings,1610612758, Cavaliers,1610612739
12/25/2017 Cavaliers at Warriors,0021700494,2017-18,2017-12-25, Warriors,1610612744, Cavaliers,1610612739
12/21/2017 Bulls at Cavaliers,0021700466,2017-18,2017-12-21, Cavaliers,1610612739, Bulls,1610612741
12/19/2017 Cavaliers at Bucks,0021700453,2017-18,2017-12-19, Bucks,1610612749, Cavaliers,1610612739
12/17/2017 Cavaliers at Wizards,0021700440,2017-18,2017-12-17, Wizards,1610612764, Cavaliers,1610612739
12/16/2017 Jazz at Cavaliers,0021700430,2017-18,2017-12-16, Cavaliers,1610612739, Jazz,1610612762
12/14/2017 Lakers at Cavaliers,0021700415,2017-18,2017-12-14, Cavaliers,1610612739, Lakers,1610612747
12/09/2017 76ers at Cavaliers,0021700379,2017-18,2017-12-09, Cavaliers,1610612739, 76ers,1610612755
12/08/2017 Cavaliers at Pacers,0021700369,2017-18,2017-12-08, Pacers,1610612754, Cavaliers,1610612739
12/06/2017 Kings at Cavaliers,0021700353,2017-18,2017-12-06, Cavaliers,1610612739, Kings,1610612758
12/04/2017 Cavaliers at Bulls,0021700344,2017-18,2017-12-04, Bulls,1610612741, Cavaliers,1610612739
12/02/2017 Grizzlies at Cavaliers,0021700329,2017-18,2017-12-02, Cavaliers,1610612739, Grizzlies,1610612763
11/28/2017 Heat at Cavaliers,0021700298,2017-18,2017-11-28, Cavaliers,1610612739, Heat,1610612748
11/27/2017 Cavaliers at 76ers,0021700291,2017-18,2017-11-27, 76ers,1610612755, Cavaliers,1610612739
11/24/2017 Hornets at Cavaliers,0021700270,2017-18,2017-11-24, Cavaliers,1610612739, Hornets,1610612766
11/22/2017 Nets at Cavaliers,0021700254,2017-18,2017-11-22, Cavaliers,1610612739, Nets,1610612751
11/20/2017 Cavaliers at Pistons,0021700242,2017-18,2017-11-20, Pistons,1610612765, Cavaliers,1610612739
11/17/2017 Clippers at Cavaliers,0021700220,2017-18,2017-11-17, Cavaliers,1610612739, Clippers,1610612746
11/15/2017 Cavaliers at Hornets,0021700207,2017-18,2017-11-15, Hornets,1610612766, Cavaliers,1610612739
11/13/2017 Cavaliers at Knicks,0021700193,2017-18,2017-11-13, Knicks,1610612752, Cavaliers,1610612739
11/11/2017 Cavaliers at Mavericks,0021700181,2017-18,2017-11-11, Mavericks,1610612742, Cavaliers,1610612739
11/09/2017 Cavaliers at Rockets,0021700166,2017-18,2017-11-09, Rockets,1610612745, Cavaliers,1610612739
11/07/2017 Bucks at Cavaliers,0021700149,2017-18,2017-11-07, Cavaliers,1610612739, Bucks,1610612749
11/03/2017 Cavaliers at Wizards,0021700122,2017-18,2017-11-03, Wizards,1610612764, Cavaliers,1610612739
11/01/2017 Pacers at Cavaliers,0021700106,2017-18,2017-11-01, Cavaliers,1610612739, Pacers,1610612754
10/29/2017 Knicks at Cavaliers,0021700090,2017-18,2017-10-29, Cavaliers,1610612739, Knicks,1610612752
10/28/2017 Cavaliers at Pelicans,0021700077,2017-18,2017-10-28, Pelicans,1610612740, Cavaliers,1610612739
10/25/2017 Cavaliers at Nets,0021700058,2017-18,2017-10-25, Nets,1610612751, Cavaliers,1610612739
10/24/2017 Bulls at Cavaliers,0021700049,2017-18,2017-10-24, Cavaliers,1610612739, Bulls,1610612741
10/21/2017 Magic at Cavaliers,0021700028,2017-18,2017-10-21, Cavaliers,1610612739, Magic,1610612753
10/20/2017 Cavaliers at Bucks,0021700021,2017-18,2017-10-20, Bucks,1610612749, Cavaliers,1610612739
04/11/2018 Spurs at Pelicans,0021701226,2017-18,2018-04-11, Pelicans,1610612740, Spurs,1610612759
04/09/2018 Pelicans at Clippers,0021701212,2017-18,2018-04-09, Clippers,1610612746, Pelicans,1610612740
04/07/2018 Pelicans at Warriors,0021701195,2017-18,2018-04-07, Warriors,1610612744, Pelicans,1610612740
04/06/2018 Pelicans at Suns,0021701189,2017-18,2018-04-06, Suns,1610612756, Pelicans,1610612740
04/04/2018 Grizzlies at Pelicans,0021701173,2017-18,2018-04-04, Pelicans,1610612740, Grizzlies,1610612763
04/01/2018 Thunder at Pelicans,0021701150,2017-18,2018-04-01, Pelicans,1610612740, Thunder,1610612760
03/27/2018 Trail Blazers at Pelicans,0021701112,2017-18,2018-03-27, Pelicans,1610612740, Trail Blazers,1610612757
03/24/2018 Pelicans at Rockets,0021701091,2017-18,2018-03-24, Rockets,1610612745, Pelicans,1610612740
03/22/2018 Lakers at Pelicans,0021701075,2017-18,2018-03-22, Pelicans,1610612740, Lakers,1610612747
03/21/2018 Pacers at Pelicans,0021700809,2017-18,2018-03-21, Pelicans,1610612740, Pacers,1610612754
03/20/2018 Mavericks at Pelicans,0021701061,2017-18,2018-03-20, Pelicans,1610612740, Mavericks,1610612742
03/17/2018 Rockets at Pelicans,0021701036,2017-18,2018-03-17, Pelicans,1610612740, Rockets,1610612745
03/15/2018 Pelicans at Spurs,0021701025,2017-18,2018-03-15, Spurs,1610612759, Pelicans,1610612740
03/13/2018 Hornets at Pelicans,0021701011,2017-18,2018-03-13, Pelicans,1610612740, Hornets,1610612766
03/11/2018 Jazz at Pelicans,0021700995,2017-18,2018-03-11, Pelicans,1610612740, Jazz,1610612762
03/09/2018 Wizards at Pelicans,0021700982,2017-18,2018-03-09, Pelicans,1610612740, Wizards,1610612764
03/07/2018 Pelicans at Kings,0021700969,2017-18,2018-03-07, Kings,1610612758, Pelicans,1610612740
03/06/2018 Pelicans at Clippers,0021700964,2017-18,2018-03-06, Clippers,1610612746, Pelicans,1610612740
03/04/2018 Pelicans at Mavericks,0021700946,2017-18,2018-03-04, Mavericks,1610612742, Pelicans,1610612740
02/28/2018 Pelicans at Spurs,0021700920,2017-18,2018-02-28, Spurs,1610612759, Pelicans,1610612740
02/26/2018 Suns at Pelicans,0021700902,2017-18,2018-02-26, Pelicans,1610612740, Suns,1610612756
02/25/2018 Pelicans at Bucks,0021700893,2017-18,2018-02-25, Bucks,1610612749, Pelicans,1610612740
02/23/2018 Heat at Pelicans,0021700879,2017-18,2018-02-23, Pelicans,1610612740, Heat,1610612748
02/14/2018 Lakers at Pelicans,0021700862,2017-18,2018-02-14, Pelicans,1610612740, Lakers,1610612747
02/12/2018 Pelicans at Pistons,0021700841,2017-18,2018-02-12, Pistons,1610612765, Pelicans,1610612740
02/10/2018 Pelicans at Nets,0021700826,2017-18,2018-02-10, Nets,1610612751, Pelicans,1610612740
02/09/2018 Pelicans at 76ers,0021700818,2017-18,2018-02-09, 76ers,1610612755, Pelicans,1610612740
02/05/2018 Jazz at Pelicans,0021700793,2017-18,2018-02-05, Pelicans,1610612740, Jazz,1610612762
02/03/2018 Pelicans at Timberwolves,0021700780,2017-18,2018-02-03, Timberwolves,1610612750, Pelicans,1610612740
02/02/2018 Pelicans at Thunder,0021700772,2017-18,2018-02-02, Thunder,1610612760, Pelicans,1610612740
01/30/2018 Kings at Pelicans,0021700749,2017-18,2018-01-30, Pelicans,1610612740, Kings,1610612758
01/28/2018 Clippers at Pelicans,0021700733,2017-18,2018-01-28, Pelicans,1610612740, Clippers,1610612746
01/26/2018 Rockets at Pelicans,0021700720,2017-18,2018-01-26, Pelicans,1610612740, Rockets,1610612745
01/24/2018 Pelicans at Hornets,0021700701,2017-18,2018-01-24, Hornets,1610612766, Pelicans,1610612740
01/22/2018 Bulls at Pelicans,0021700692,2017-18,2018-01-22, Pelicans,1610612740, Bulls,1610612741
01/20/2018 Grizzlies at Pelicans,0021700677,2017-18,2018-01-20, Pelicans,1610612740, Grizzlies,1610612763
01/14/2018 Pelicans at Knicks,0021700635,2017-18,2018-01-14, Knicks,1610612752, Pelicans,1610612740
01/12/2018 Trail Blazers at Pelicans,0021700624,2017-18,2018-01-12, Pelicans,1610612740, Trail Blazers,1610612757
01/10/2018 Pelicans at Grizzlies,0021700609,2017-18,2018-01-10, Grizzlies,1610612763, Pelicans,1610612740
01/08/2018 Pistons at Pelicans,0021700595,2017-18,2018-01-08, Pelicans,1610612740, Pistons,1610612765
01/06/2018 Pelicans at Timberwolves,0021700584,2017-18,2018-01-06, Timberwolves,1610612750, Pelicans,1610612740
01/03/2018 Pelicans at Jazz,0021700564,2017-18,2018-01-03, Jazz,1610612762, Pelicans,1610612740
12/30/2017 Knicks at Pelicans,0021700532,2017-18,2017-12-30, Pelicans,1610612740, Knicks,1610612752
12/29/2017 Mavericks at Pelicans,0021700525,2017-18,2017-12-29, Pelicans,1610612740, Mavericks,1610612742
12/27/2017 Nets at Pelicans,0021700511,2017-18,2017-12-27, Pelicans,1610612740, Nets,1610612751
12/23/2017 Pelicans at Heat,0021700486,2017-18,2017-12-23, Heat,1610612748, Pelicans,1610612740
12/22/2017 Pelicans at Magic,0021700472,2017-18,2017-12-22, Magic,1610612753, Pelicans,1610612740
12/19/2017 Pelicans at Wizards,0021700452,2017-18,2017-12-19, Wizards,1610612764, Pelicans,1610612740
12/15/2017 Pelicans at Nuggets,0021700427,2017-18,2017-12-15, Nuggets,1610612743, Pelicans,1610612740
12/13/2017 Bucks at Pelicans,0021700410,2017-18,2017-12-13, Pelicans,1610612740, Bucks,1610612749
12/11/2017 Pelicans at Rockets,0021700392,2017-18,2017-12-11, Rockets,1610612745, Pelicans,1610612740
12/10/2017 76ers at Pelicans,0021700389,2017-18,2017-12-10, Pelicans,1610612740, 76ers,1610612755
12/08/2017 Kings at Pelicans,0021700373,2017-18,2017-12-08, Pelicans,1610612740, Kings,1610612758
12/06/2017 Nuggets at Pelicans,0021700360,2017-18,2017-12-06, Pelicans,1610612740, Nuggets,1610612743
12/04/2017 Warriors at Pelicans,0021700346,2017-18,2017-12-04, Pelicans,1610612740, Warriors,1610612744
12/02/2017 Pelicans at Trail Blazers,0021700333,2017-18,2017-12-02, Trail Blazers,1610612757, Pelicans,1610612740
12/01/2017 Pelicans at Jazz,0021700325,2017-18,2017-12-01, Jazz,1610612762, Pelicans,1610612740
11/29/2017 Timberwolves at Pelicans,0021700309,2017-18,2017-11-29, Pelicans,1610612740, Timberwolves,1610612750
11/25/2017 Pelicans at Warriors,0021700284,2017-18,2017-11-25, Warriors,1610612744, Pelicans,1610612740
11/24/2017 Pelicans at Suns,0021700275,2017-18,2017-11-24, Suns,1610612756, Pelicans,1610612740
11/22/2017 Spurs at Pelicans,0021700262,2017-18,2017-11-22, Pelicans,1610612740, Spurs,1610612759
11/20/2017 Thunder at Pelicans,0021700248,2017-18,2017-11-20, Pelicans,1610612740, Thunder,1610612760
11/17/2017 Pelicans at Nuggets,0021700226,2017-18,2017-11-17, Nuggets,1610612743, Pelicans,1610612740
11/15/2017 Raptors at Pelicans,0021700211,2017-18,2017-11-15, Pelicans,1610612740, Raptors,1610612761
11/11/2017 Clippers at Pelicans,0021700178,2017-18,2017-11-11, Pelicans,1610612740, Clippers,1610612746
11/09/2017 Pelicans at Raptors,0021700165,2017-18,2017-11-09, Raptors,1610612761, Pelicans,1610612740
11/07/2017 Pelicans at Pacers,0021700150,2017-18,2017-11-07, Pacers,1610612754, Pelicans,1610612740
11/04/2017 Pelicans at Bulls,0021700133,2017-18,2017-11-04, Bulls,1610612741, Pelicans,1610612740
11/03/2017 Pelicans at Mavericks,0021700125,2017-18,2017-11-03, Mavericks,1610612742, Pelicans,1610612740
11/01/2017 Timberwolves at Pelicans,0021700113,2017-18,2017-11-01, Pelicans,1610612740, Timberwolves,1610612750
10/30/2017 Magic at Pelicans,0021700097,2017-18,2017-10-30, Pelicans,1610612740, Magic,1610612753
10/26/2017 Pelicans at Kings,0021700069,2017-18,2017-10-26, Kings,1610612758, Pelicans,1610612740
10/24/2017 Pelicans at Trail Blazers,0021700053,2017-18,2017-10-24, Trail Blazers,1610612757, Pelicans,1610612740
10/22/2017 Pelicans at Lakers,0021700040,2017-18,2017-10-22, Lakers,1610612747, Pelicans,1610612740
10/20/2017 Warriors at Pelicans,0021700025,2017-18,2017-10-20, Pelicans,1610612740, Warriors,1610612744
10/18/2017 Pelicans at Grizzlies,0021700008,2017-18,2017-10-18, Grizzlies,1610612763, Pelicans,1610612740
04/11/2018 Pistons at Bulls,0021701224,2017-18,2018-04-11, Bulls,1610612741, Pistons,1610612765
04/09/2018 Bulls at Nets,0021701205,2017-18,2018-04-09, Nets,1610612751, Bulls,1610612741
04/07/2018 Nets at Bulls,0021701193,2017-18,2018-04-07, Bulls,1610612741, Nets,1610612751
04/03/2018 Hornets at Bulls,0021701160,2017-18,2018-04-03, Bulls,1610612741, Hornets,1610612766
04/01/2018 Wizards at Bulls,0021701144,2017-18,2018-04-01, Bulls,1610612741, Wizards,1610612764
03/30/2018 Bulls at Magic,0021701129,2017-18,2018-03-30, Magic,1610612753, Bulls,1610612741
03/29/2018 Bulls at Heat,0021701125,2017-18,2018-03-29, Heat,1610612748, Bulls,1610612741
03/27/2018 Bulls at Rockets,0021701111,2017-18,2018-03-27, Rockets,1610612745, Bulls,1610612741
03/24/2018 Bulls at Pistons,0021701089,2017-18,2018-03-24, Pistons,1610612765, Bulls,1610612741
03/23/2018 Bucks at Bulls,0021701083,2017-18,2018-03-23, Bulls,1610612741, Bucks,1610612749
03/21/2018 Nuggets at Bulls,0021701069,2017-18,2018-03-21, Bulls,1610612741, Nuggets,1610612743
03/19/2018 Bulls at Knicks,0021701055,2017-18,2018-03-19, Knicks,1610612752, Bulls,1610612741
03/15/2018 Bulls at Grizzlies,0021701024,2017-18,2018-03-15, Grizzlies,1610612763, Bulls,1610612741
03/13/2018 Clippers at Bulls,0021701010,2017-18,2018-03-13, Bulls,1610612741, Clippers,1610612746
03/09/2018 Bulls at Pistons,0021700977,2017-18,2018-03-09, Pistons,1610612765, Bulls,1610612741
03/07/2018 Grizzlies at Bulls,0021700967,2017-18,2018-03-07, Bulls,1610612741, Grizzlies,1610612763
03/02/2018 Mavericks at Bulls,0021700930,2017-18,2018-03-02, Bulls,1610612741, Mavericks,1610612742
02/27/2018 Bulls at Hornets,0021700907,2017-18,2018-02-27, Hornets,1610612766, Bulls,1610612741
02/26/2018 Bulls at Nets,0021700899,2017-18,2018-02-26, Nets,1610612751, Bulls,1610612741
02/24/2018 Bulls at Timberwolves,0021700888,2017-18,2018-02-24, Timberwolves,1610612750, Bulls,1610612741
02/22/2018 76ers at Bulls,0021700870,2017-18,2018-02-22, Bulls,1610612741, 76ers,1610612755
02/14/2018 Raptors at Bulls,0021700859,2017-18,2018-02-14, Bulls,1610612741, Raptors,1610612761
02/12/2018 Magic at Bulls,0021700844,2017-18,2018-02-12, Bulls,1610612741, Magic,1610612753
02/10/2018 Wizards at Bulls,0021700829,2017-18,2018-02-10, Bulls,1610612741, Wizards,1610612764
02/09/2018 Timberwolves at Bulls,0021700822,2017-18,2018-02-09, Bulls,1610612741, Timberwolves,1610612750
02/05/2018 Bulls at Kings,0021700795,2017-18,2018-02-05, Kings,1610612758, Bulls,1610612741
02/03/2018 Bulls at Clippers,0021700775,2017-18,2018-02-03, Clippers,1610612746, Bulls,1610612741
01/31/2018 Bulls at Trail Blazers,0021700759,2017-18,2018-01-31, Trail Blazers,1610612757, Bulls,1610612741
01/28/2018 Bucks at Bulls,0021700731,2017-18,2018-01-28, Bulls,1610612741, Bucks,1610612749
01/26/2018 Lakers at Bulls,0021700717,2017-18,2018-01-26, Bulls,1610612741, Lakers,1610612747
01/24/2018 Bulls at 76ers,0021700704,2017-18,2018-01-24, 76ers,1610612755, Bulls,1610612741
01/17/2018 Warriors at Bulls,0021700657,2017-18,2018-01-17, Bulls,1610612741, Warriors,1610612744
01/15/2018 Heat at Bulls,0021700644,2017-18,2018-01-15, Bulls,1610612741, Heat,1610612748
01/13/2018 Pistons at Bulls,0021700632,2017-18,2018-01-13, Bulls,1610612741, Pistons,1610612765
01/10/2018 Bulls at Knicks,0021700607,2017-18,2018-01-10, Knicks,1610612752, Bulls,1610612741
01/08/2018 Rockets at Bulls,0021700593,2017-18,2018-01-08, Bulls,1610612741, Rockets,1610612745
01/06/2018 Bulls at Pacers,0021700581,2017-18,2018-01-06, Pacers,1610612754, Bulls,1610612741
01/05/2018 Bulls at Mavericks,0021700572,2017-18,2018-01-05, Mavericks,1610612742, Bulls,1610612741
01/03/2018 Raptors at Bulls,0021700560,2017-18,2018-01-03, Bulls,1610612741, Raptors,1610612761
01/01/2018 Trail Blazers at Bulls,0021700547,2017-18,2018-01-01, Bulls,1610612741, Trail Blazers,1610612757
12/31/2017 Bulls at Wizards,0021700537,2017-18,2017-12-31, Wizards,1610612764, Bulls,1610612741
12/29/2017 Pacers at Bulls,0021700524,2017-18,2017-12-29, Bulls,1610612741, Pacers,1610612754
12/27/2017 Knicks at Bulls,0021700509,2017-18,2017-12-27, Bulls,1610612741, Knicks,1610612752
12/26/2017 Bulls at Bucks,0021700501,2017-18,2017-12-26, Bucks,1610612749, Bulls,1610612741
12/20/2017 Magic at Bulls,0021700458,2017-18,2017-12-20, Bulls,1610612741, Magic,1610612753
12/18/2017 76ers at Bulls,0021700444,2017-18,2017-12-18, Bulls,1610612741, 76ers,1610612755
12/15/2017 Bulls at Bucks,0021700426,2017-18,2017-12-15, Bucks,1610612749, Bulls,1610612741
12/13/2017 Jazz at Bulls,0021700409,2017-18,2017-12-13, Bulls,1610612741, Jazz,1610612762
12/09/2017 Knicks at Bulls,0021700380,2017-18,2017-12-09, Bulls,1610612741, Knicks,1610612752
12/08/2017 Bulls at Hornets,0021700367,2017-18,2017-12-08, Hornets,1610612766, Bulls,1610612741
12/06/2017 Bulls at Pacers,0021700354,2017-18,2017-12-06, Pacers,1610612754, Bulls,1610612741
12/01/2017 Kings at Bulls,0021700322,2017-18,2017-12-01, Bulls,1610612741, Kings,1610612758
11/30/2017 Bulls at Nuggets,0021700315,2017-18,2017-11-30, Nuggets,1610612743, Bulls,1610612741
11/28/2017 Suns at Bulls,0021700299,2017-18,2017-11-28, Bulls,1610612741, Suns,1610612756
11/26/2017 Heat at Bulls,0021700287,2017-18,2017-11-26, Bulls,1610612741, Heat,1610612748
11/24/2017 Bulls at Warriors,0021700276,2017-18,2017-11-24, Warriors,1610612744, Bulls,1610612741
11/22/2017 Bulls at Jazz,0021700265,2017-18,2017-11-22, Jazz,1610612762, Bulls,1610612741
11/21/2017 Bulls at Lakers,0021700252,2017-18,2017-11-21, Lakers,1610612747, Bulls,1610612741
11/19/2017 Bulls at Suns,0021700239,2017-18,2017-11-19, Suns,1610612756, Bulls,1610612741
11/17/2017 Hornets at Bulls,0021700222,2017-18,2017-11-17, Bulls,1610612741, Hornets,1610612766
11/15/2017 Bulls at Thunder,0021700212,2017-18,2017-11-15, Thunder,1610612760, Bulls,1610612741
11/11/2017 Bulls at Spurs,0021700183,2017-18,2017-11-11, Spurs,1610612759, Bulls,1610612741
11/10/2017 Pacers at Bulls,0021700171,2017-18,2017-11-10, Bulls,1610612741, Pacers,1610612754
11/07/2017 Bulls at Raptors,0021700153,2017-18,2017-11-07, Raptors,1610612761, Bulls,1610612741
11/03/2017 Bulls at Magic,0021700120,2017-18,2017-11-03, Magic,1610612753, Bulls,1610612741
11/01/2017 Bulls at Heat,0021700110,2017-18,2017-11-01, Heat,1610612748, Bulls,1610612741
10/28/2017 Thunder at Bulls,0021700079,2017-18,2017-10-28, Bulls,1610612741, Thunder,1610612760
10/21/2017 Spurs at Bulls,0021700031,2017-18,2017-10-21, Bulls,1610612741, Spurs,1610612759
10/19/2017 Bulls at Raptors,0021700014,2017-18,2017-10-19, Raptors,1610612761, Bulls,1610612741
04/10/2018 Suns at Mavericks,0021701216,2017-18,2018-04-10, Mavericks,1610612742, Suns,1610612756
04/08/2018 Mavericks at 76ers,0021701198,2017-18,2018-04-08, 76ers,1610612755, Mavericks,1610612742
04/06/2018 Mavericks at Pistons,0021701181,2017-18,2018-04-06, Pistons,1610612765, Mavericks,1610612742
04/04/2018 Mavericks at Magic,0021701170,2017-18,2018-04-04, Magic,1610612753, Mavericks,1610612742
04/03/2018 Trail Blazers at Mavericks,0021701164,2017-18,2018-04-03, Mavericks,1610612742, Trail Blazers,1610612757
03/30/2018 Timberwolves at Mavericks,0021701134,2017-18,2018-03-30, Mavericks,1610612742, Timberwolves,1610612750
03/28/2018 Mavericks at Lakers,0021701123,2017-18,2018-03-28, Lakers,1610612747, Mavericks,1610612742
03/27/2018 Mavericks at Kings,0021701113,2017-18,2018-03-27, Kings,1610612758, Mavericks,1610612742
03/24/2018 Hornets at Mavericks,0021701093,2017-18,2018-03-24, Mavericks,1610612742, Hornets,1610612766
03/22/2018 Jazz at Mavericks,0021701076,2017-18,2018-03-22, Mavericks,1610612742, Jazz,1610612762
03/17/2018 Mavericks at Nets,0021701037,2017-18,2018-03-17, Nets,1610612751, Mavericks,1610612742
03/16/2018 Mavericks at Raptors,0021701031,2017-18,2018-03-16, Raptors,1610612761, Mavericks,1610612742
03/13/2018 Mavericks at Knicks,0021701009,2017-18,2018-03-13, Knicks,1610612752, Mavericks,1610612742
03/11/2018 Rockets at Mavericks,0021700997,2017-18,2018-03-11, Mavericks,1610612742, Rockets,1610612745
03/10/2018 Grizzlies at Mavericks,0021700989,2017-18,2018-03-10, Mavericks,1610612742, Grizzlies,1610612763
03/06/2018 Nuggets at Mavericks,0021700961,2017-18,2018-03-06, Mavericks,1610612742, Nuggets,1610612743
02/28/2018 Thunder at Mavericks,0021700919,2017-18,2018-02-28, Mavericks,1610612742, Thunder,1610612760
02/26/2018 Pacers at Mavericks,0021700904,2017-18,2018-02-26, Mavericks,1610612742, Pacers,1610612754
02/24/2018 Mavericks at Jazz,0021700890,2017-18,2018-02-24, Jazz,1610612762, Mavericks,1610612742
02/23/2018 Mavericks at Lakers,0021700883,2017-18,2018-02-23, Lakers,1610612747, Mavericks,1610612742
02/13/2018 Kings at Mavericks,0021700851,2017-18,2018-02-13, Mavericks,1610612742, Kings,1610612758
02/11/2018 Mavericks at Rockets,0021700837,2017-18,2018-02-11, Rockets,1610612745, Mavericks,1610612742
02/10/2018 Lakers at Mavericks,0021700830,2017-18,2018-02-10, Mavericks,1610612742, Lakers,1610612747
02/08/2018 Mavericks at Warriors,0021700815,2017-18,2018-02-08, Warriors,1610612744, Mavericks,1610612742
02/05/2018 Mavericks at Clippers,0021700796,2017-18,2018-02-05, Clippers,1610612746, Mavericks,1610612742
02/03/2018 Mavericks at Kings,0021700783,2017-18,2018-02-03, Kings,1610612758, Mavericks,1610612742
01/31/2018 Mavericks at Suns,0021700760,2017-18,2018-01-31, Suns,1610612756, Mavericks,1610612742
01/29/2018 Heat at Mavericks,0021700742,2017-18,2018-01-29, Mavericks,1610612742, Heat,1610612748
01/27/2018 Mavericks at Nuggets,0021700730,2017-18,2018-01-27, Nuggets,1610612743, Mavericks,1610612742
01/26/2018 Trail Blazers at Mavericks,0021700721,2017-18,2018-01-26, Mavericks,1610612742, Trail Blazers,1610612757
01/24/2018 Rockets at Mavericks,0021700706,2017-18,2018-01-24, Mavericks,1610612742, Rockets,1610612745
01/22/2018 Wizards at Mavericks,0021700693,2017-18,2018-01-22, Mavericks,1610612742, Wizards,1610612764
01/20/2018 Mavericks at Trail Blazers,0021700682,2017-18,2018-01-20, Trail Blazers,1610612757, Mavericks,1610612742
01/16/2018 Mavericks at Nuggets,0021700651,2017-18,2018-01-16, Nuggets,1610612743, Mavericks,1610612742
01/13/2018 Lakers at Mavericks,0021700627,2017-18,2018-01-13, Mavericks,1610612742, Lakers,1610612747
01/10/2018 Mavericks at Hornets,0021700603,2017-18,2018-01-10, Hornets,1610612766, Mavericks,1610612742
01/09/2018 Magic at Mavericks,0021700601,2017-18,2018-01-09, Mavericks,1610612742, Magic,1610612753
01/07/2018 Knicks at Mavericks,0021700587,2017-18,2018-01-07, Mavericks,1610612742, Knicks,1610612752
01/03/2018 Warriors at Mavericks,0021700562,2017-18,2018-01-03, Mavericks,1610612742, Warriors,1610612744
12/31/2017 Mavericks at Thunder,0021700541,2017-18,2017-12-31, Thunder,1610612760, Mavericks,1610612742
12/27/2017 Mavericks at Pacers,0021700507,2017-18,2017-12-27, Pacers,1610612754, Mavericks,1610612742
12/26/2017 Raptors at Mavericks,0021700499,2017-18,2017-12-26, Mavericks,1610612742, Raptors,1610612761
12/22/2017 Mavericks at Heat,0021700474,2017-18,2017-12-22, Heat,1610612748, Mavericks,1610612742
12/20/2017 Pistons at Mavericks,0021700461,2017-18,2017-12-20, Mavericks,1610612742, Pistons,1610612765
12/18/2017 Suns at Mavericks,0021700448,2017-18,2017-12-18, Mavericks,1610612742, Suns,1610612756
12/16/2017 Mavericks at Spurs,0021700435,2017-18,2017-12-16, Spurs,1610612759, Mavericks,1610612742
12/14/2017 Mavericks at Warriors,0021700417,2017-18,2017-12-14, Warriors,1610612744, Mavericks,1610612742
12/12/2017 Spurs at Mavericks,0021700402,2017-18,2017-12-12, Mavericks,1610612742, Spurs,1610612759
12/10/2017 Mavericks at Timberwolves,0021700388,2017-18,2017-12-10, Timberwolves,1610612750, Mavericks,1610612742
12/08/2017 Mavericks at Bucks,0021700372,2017-18,2017-12-08, Bucks,1610612749, Mavericks,1610612742
12/04/2017 Nuggets at Mavericks,0021700347,2017-18,2017-12-04, Mavericks,1610612742, Nuggets,1610612743
12/02/2017 Clippers at Mavericks,0021700327,2017-18,2017-12-02, Mavericks,1610612742, Clippers,1610612746
11/29/2017 Nets at Mavericks,0021700310,2017-18,2017-11-29, Mavericks,1610612742, Nets,1610612751
11/27/2017 Mavericks at Spurs,0021700295,2017-18,2017-11-27, Spurs,1610612759, Mavericks,1610612742
11/25/2017 Thunder at Mavericks,0021700283,2017-18,2017-11-25, Mavericks,1610612742, Thunder,1610612760
11/22/2017 Mavericks at Grizzlies,0021700260,2017-18,2017-11-22, Grizzlies,1610612763, Mavericks,1610612742
11/18/2017 Bucks at Mavericks,0021700233,2017-18,2017-11-18, Mavericks,1610612742, Bucks,1610612749
11/17/2017 Timberwolves at Mavericks,0021700224,2017-18,2017-11-17, Mavericks,1610612742, Timberwolves,1610612750
11/14/2017 Spurs at Mavericks,0021700203,2017-18,2017-11-14, Mavericks,1610612742, Spurs,1610612759
11/12/2017 Mavericks at Thunder,0021700191,2017-18,2017-11-12, Thunder,1610612760, Mavericks,1610612742
11/07/2017 Mavericks at Wizards,0021700151,2017-18,2017-11-07, Wizards,1610612764, Mavericks,1610612742
11/04/2017 Mavericks at Timberwolves,0021700134,2017-18,2017-11-04, Timberwolves,1610612750, Mavericks,1610612742
11/01/2017 Mavericks at Clippers,0021700116,2017-18,2017-11-01, Clippers,1610612746, Mavericks,1610612742
10/30/2017 Mavericks at Jazz,0021700098,2017-18,2017-10-30, Jazz,1610612762, Mavericks,1610612742
10/28/2017 76ers at Mavericks,0021700081,2017-18,2017-10-28, Mavericks,1610612742, 76ers,1610612755
10/26/2017 Mavericks at Grizzlies,0021700066,2017-18,2017-10-26, Grizzlies,1610612763, Mavericks,1610612742
10/25/2017 Grizzlies at Mavericks,0021700061,2017-18,2017-10-25, Mavericks,1610612742, Grizzlies,1610612763
10/23/2017 Warriors at Mavericks,0021700045,2017-18,2017-10-23, Mavericks,1610612742, Warriors,1610612744
10/21/2017 Mavericks at Rockets,0021700032,2017-18,2017-10-21, Rockets,1610612745, Mavericks,1610612742
10/20/2017 Kings at Mavericks,0021700024,2017-18,2017-10-20, Mavericks,1610612742, Kings,1610612758
04/11/2018 Nuggets at Timberwolves,0021701225,2017-18,2018-04-11, Timberwolves,1610612750, Nuggets,1610612743
04/09/2018 Trail Blazers at Nuggets,0021701211,2017-18,2018-04-09, Nuggets,1610612743, Trail Blazers,1610612757
04/07/2018 Nuggets at Clippers,0021701191,2017-18,2018-04-07, Clippers,1610612746, Nuggets,1610612743
04/05/2018 Timberwolves at Nuggets,0021701180,2017-18,2018-04-05, Nuggets,1610612743, Timberwolves,1610612750
04/03/2018 Pacers at Nuggets,0021701165,2017-18,2018-04-03, Nuggets,1610612743, Pacers,1610612754
04/01/2018 Bucks at Nuggets,0021701152,2017-18,2018-04-01, Nuggets,1610612743, Bucks,1610612749
03/30/2018 Nuggets at Thunder,0021701133,2017-18,2018-03-30, Thunder,1610612760, Nuggets,1610612743
03/27/2018 Nuggets at Raptors,0021701109,2017-18,2018-03-27, Raptors,1610612761, Nuggets,1610612743
03/26/2018 Nuggets at 76ers,0021701105,2017-18,2018-03-26, 76ers,1610612755, Nuggets,1610612743
03/23/2018 Nuggets at Wizards,0021701079,2017-18,2018-03-23, Wizards,1610612764, Nuggets,1610612743
03/19/2018 Nuggets at Heat,0021701054,2017-18,2018-03-19, Heat,1610612748, Nuggets,1610612743
03/17/2018 Nuggets at Grizzlies,0021701040,2017-18,2018-03-17, Grizzlies,1610612763, Nuggets,1610612743
03/15/2018 Pistons at Nuggets,0021701026,2017-18,2018-03-15, Nuggets,1610612743, Pistons,1610612765
03/13/2018 Nuggets at Lakers,0021701015,2017-18,2018-03-13, Lakers,1610612747, Nuggets,1610612743
03/11/2018 Kings at Nuggets,0021700996,2017-18,2018-03-11, Nuggets,1610612743, Kings,1610612758
03/09/2018 Lakers at Nuggets,0021700983,2017-18,2018-03-09, Nuggets,1610612743, Lakers,1610612747
03/02/2018 Nuggets at Grizzlies,0021700931,2017-18,2018-03-02, Grizzlies,1610612763, Nuggets,1610612743
02/27/2018 Clippers at Nuggets,0021700912,2017-18,2018-02-27, Nuggets,1610612743, Clippers,1610612746
02/25/2018 Rockets at Nuggets,0021700896,2017-18,2018-02-25, Nuggets,1610612743, Rockets,1610612745
02/23/2018 Spurs at Nuggets,0021700880,2017-18,2018-02-23, Nuggets,1610612743, Spurs,1610612759
02/15/2018 Nuggets at Bucks,0021700865,2017-18,2018-02-15, Bucks,1610612749, Nuggets,1610612743
02/13/2018 Spurs at Nuggets,0021700852,2017-18,2018-02-13, Nuggets,1610612743, Spurs,1610612759
02/10/2018 Nuggets at Suns,0021700832,2017-18,2018-02-10, Suns,1610612756, Nuggets,1610612743
02/09/2018 Nuggets at Rockets,0021700823,2017-18,2018-02-09, Rockets,1610612745, Nuggets,1610612743
02/05/2018 Hornets at Nuggets,0021700794,2017-18,2018-02-05, Nuggets,1610612743, Hornets,1610612766
02/03/2018 Warriors at Nuggets,0021700782,2017-18,2018-02-03, Nuggets,1610612743, Warriors,1610612744
02/01/2018 Thunder at Nuggets,0021700765,2017-18,2018-02-01, Nuggets,1610612743, Thunder,1610612760
01/30/2018 Nuggets at Spurs,0021700750,2017-18,2018-01-30, Spurs,1610612759, Nuggets,1610612743
01/25/2018 Knicks at Nuggets,0021700712,2017-18,2018-01-25, Nuggets,1610612743, Knicks,1610612752
01/22/2018 Trail Blazers at Nuggets,0021700694,2017-18,2018-01-22, Nuggets,1610612743, Trail Blazers,1610612757
01/19/2018 Suns at Nuggets,0021700671,2017-18,2018-01-19, Nuggets,1610612743, Suns,1610612756
01/17/2018 Nuggets at Clippers,0021700662,2017-18,2018-01-17, Clippers,1610612746, Nuggets,1610612743
01/13/2018 Nuggets at Spurs,0021700633,2017-18,2018-01-13, Spurs,1610612759, Nuggets,1610612743
01/12/2018 Grizzlies at Nuggets,0021700625,2017-18,2018-01-12, Nuggets,1610612743, Grizzlies,1610612763
01/08/2018 Nuggets at Warriors,0021700597,2017-18,2018-01-08, Warriors,1610612744, Nuggets,1610612743
01/06/2018 Nuggets at Kings,0021700585,2017-18,2018-01-06, Kings,1610612758, Nuggets,1610612743
01/05/2018 Jazz at Nuggets,0021700574,2017-18,2018-01-05, Nuggets,1610612743, Jazz,1610612762
01/03/2018 Suns at Nuggets,0021700563,2017-18,2018-01-03, Nuggets,1610612743, Suns,1610612756
12/30/2017 76ers at Nuggets,0021700536,2017-18,2017-12-30, Nuggets,1610612743, 76ers,1610612755
12/27/2017 Nuggets at Timberwolves,0021700510,2017-18,2017-12-27, Timberwolves,1610612750, Nuggets,1610612743
12/26/2017 Jazz at Nuggets,0021700503,2017-18,2017-12-26, Nuggets,1610612743, Jazz,1610612762
12/23/2017 Nuggets at Warriors,0021700489,2017-18,2017-12-23, Warriors,1610612744, Nuggets,1610612743
12/22/2017 Nuggets at Trail Blazers,0021700478,2017-18,2017-12-22, Trail Blazers,1610612757, Nuggets,1610612743
12/20/2017 Timberwolves at Nuggets,0021700462,2017-18,2017-12-20, Nuggets,1610612743, Timberwolves,1610612750
12/18/2017 Nuggets at Thunder,0021700447,2017-18,2017-12-18, Thunder,1610612760, Nuggets,1610612743
12/12/2017 Nuggets at Pistons,0021700398,2017-18,2017-12-12, Pistons,1610612765, Nuggets,1610612743
12/10/2017 Nuggets at Pacers,0021700387,2017-18,2017-12-10, Pacers,1610612754, Nuggets,1610612743
12/08/2017 Nuggets at Magic,0021700370,2017-18,2017-12-08, Magic,1610612753, Nuggets,1610612743
12/02/2017 Lakers at Nuggets,0021700332,2017-18,2017-12-02, Nuggets,1610612743, Lakers,1610612747
11/28/2017 Nuggets at Jazz,0021700301,2017-18,2017-11-28, Jazz,1610612762, Nuggets,1610612743
11/24/2017 Grizzlies at Nuggets,0021700274,2017-18,2017-11-24, Nuggets,1610612743, Grizzlies,1610612763
11/22/2017 Nuggets at Rockets,0021700259,2017-18,2017-11-22, Rockets,1610612745, Nuggets,1610612743
11/20/2017 Nuggets at Kings,0021700251,2017-18,2017-11-20, Kings,1610612758, Nuggets,1610612743
11/19/2017 Nuggets at Lakers,0021700240,2017-18,2017-11-19, Lakers,1610612747, Nuggets,1610612743
11/13/2017 Nuggets at Trail Blazers,0021700198,2017-18,2017-11-13, Trail Blazers,1610612757, Nuggets,1610612743
11/11/2017 Magic at Nuggets,0021700185,2017-18,2017-11-11, Nuggets,1610612743, Magic,1610612753
11/09/2017 Thunder at Nuggets,0021700168,2017-18,2017-11-09, Nuggets,1610612743, Thunder,1610612760
11/07/2017 Nets at Nuggets,0021700155,2017-18,2017-11-07, Nuggets,1610612743, Nets,1610612751
11/04/2017 Warriors at Nuggets,0021700135,2017-18,2017-11-04, Nuggets,1610612743, Warriors,1610612744
11/03/2017 Heat at Nuggets,0021700127,2017-18,2017-11-03, Nuggets,1610612743, Heat,1610612748
11/01/2017 Raptors at Nuggets,0021700114,2017-18,2017-11-01, Nuggets,1610612743, Raptors,1610612761
10/30/2017 Nuggets at Knicks,0021700094,2017-18,2017-10-30, Knicks,1610612752, Nuggets,1610612743
10/29/2017 Nuggets at Nets,0021700087,2017-18,2017-10-29, Nets,1610612751, Nuggets,1610612743
10/25/2017 Nuggets at Hornets,0021700055,2017-18,2017-10-25, Hornets,1610612766, Nuggets,1610612743
10/23/2017 Wizards at Nuggets,0021700047,2017-18,2017-10-23, Nuggets,1610612743, Wizards,1610612764
10/21/2017 Kings at Nuggets,0021700035,2017-18,2017-10-21, Nuggets,1610612743, Kings,1610612758
10/18/2017 Nuggets at Jazz,0021700010,2017-18,2017-10-18, Jazz,1610612762, Nuggets,1610612743
04/10/2018 Warriors at Jazz,0021701217,2017-18,2018-04-10, Jazz,1610612762, Warriors,1610612744
04/08/2018 Warriors at Suns,0021701203,2017-18,2018-04-08, Suns,1610612756, Warriors,1610612744
04/05/2018 Warriors at Pacers,0021701175,2017-18,2018-04-05, Pacers,1610612754, Warriors,1610612744
04/03/2018 Warriors at Thunder,0021701163,2017-18,2018-04-03, Thunder,1610612760, Warriors,1610612744
04/01/2018 Suns at Warriors,0021701153,2017-18,2018-04-01, Warriors,1610612744, Suns,1610612756
03/31/2018 Warriors at Kings,0021701142,2017-18,2018-03-31, Kings,1610612758, Warriors,1610612744
03/29/2018 Bucks at Warriors,0021701128,2017-18,2018-03-29, Warriors,1610612744, Bucks,1610612749
03/27/2018 Pacers at Warriors,0021701114,2017-18,2018-03-27, Warriors,1610612744, Pacers,1610612754
03/25/2018 Jazz at Warriors,0021701102,2017-18,2018-03-25, Warriors,1610612744, Jazz,1610612762
03/19/2018 Warriors at Spurs,0021701056,2017-18,2018-03-19, Spurs,1610612759, Warriors,1610612744
03/17/2018 Warriors at Suns,0021701044,2017-18,2018-03-17, Suns,1610612756, Warriors,1610612744
03/16/2018 Kings at Warriors,0021701033,2017-18,2018-03-16, Warriors,1610612744, Kings,1610612758
03/14/2018 Lakers at Warriors,0021701019,2017-18,2018-03-14, Warriors,1610612744, Lakers,1610612747
03/11/2018 Warriors at Timberwolves,0021700994,2017-18,2018-03-11, Timberwolves,1610612750, Warriors,1610612744
03/09/2018 Warriors at Trail Blazers,0021700984,2017-18,2018-03-09, Trail Blazers,1610612757, Warriors,1610612744
03/08/2018 Spurs at Warriors,0021700976,2017-18,2018-03-08, Warriors,1610612744, Spurs,1610612759
03/06/2018 Nets at Warriors,0021700963,2017-18,2018-03-06, Warriors,1610612744, Nets,1610612751
02/28/2018 Warriors at Wizards,0021700917,2017-18,2018-02-28, Wizards,1610612764, Warriors,1610612744
02/26/2018 Warriors at Knicks,0021700900,2017-18,2018-02-26, Knicks,1610612752, Warriors,1610612744
02/24/2018 Thunder at Warriors,0021700887,2017-18,2018-02-24, Warriors,1610612744, Thunder,1610612760
02/22/2018 Clippers at Warriors,0021700872,2017-18,2018-02-22, Warriors,1610612744, Clippers,1610612746
02/14/2018 Warriors at Trail Blazers,0021700864,2017-18,2018-02-14, Trail Blazers,1610612757, Warriors,1610612744
02/12/2018 Suns at Warriors,0021700846,2017-18,2018-02-12, Warriors,1610612744, Suns,1610612756
02/10/2018 Spurs at Warriors,0021700831,2017-18,2018-02-10, Warriors,1610612744, Spurs,1610612759
02/06/2018 Thunder at Warriors,0021700803,2017-18,2018-02-06, Warriors,1610612744, Thunder,1610612760
02/02/2018 Warriors at Kings,0021700774,2017-18,2018-02-02, Kings,1610612758, Warriors,1610612744
01/30/2018 Warriors at Jazz,0021700751,2017-18,2018-01-30, Jazz,1610612762, Warriors,1610612744
01/25/2018 Timberwolves at Warriors,0021700713,2017-18,2018-01-25, Warriors,1610612744, Timberwolves,1610612750
01/23/2018 Knicks at Warriors,0021700699,2017-18,2018-01-23, Warriors,1610612744, Knicks,1610612752
01/20/2018 Warriors at Rockets,0021700679,2017-18,2018-01-20, Rockets,1610612745, Warriors,1610612744
01/13/2018 Warriors at Raptors,0021700631,2017-18,2018-01-13, Raptors,1610612761, Warriors,1610612744
01/12/2018 Warriors at Bucks,0021700622,2017-18,2018-01-12, Bucks,1610612749, Warriors,1610612744
01/10/2018 Clippers at Warriors,0021700613,2017-18,2018-01-10, Warriors,1610612744, Clippers,1610612746
01/06/2018 Warriors at Clippers,0021700578,2017-18,2018-01-06, Clippers,1610612746, Warriors,1610612744
01/04/2018 Warriors at Rockets,0021700566,2017-18,2018-01-04, Rockets,1610612745, Warriors,1610612744
12/30/2017 Grizzlies at Warriors,0021700535,2017-18,2017-12-30, Warriors,1610612744, Grizzlies,1610612763
12/29/2017 Hornets at Warriors,0021700528,2017-18,2017-12-29, Warriors,1610612744, Hornets,1610612766
12/27/2017 Jazz at Warriors,0021700514,2017-18,2017-12-27, Warriors,1610612744, Jazz,1610612762
12/22/2017 Lakers at Warriors,0021700479,2017-18,2017-12-22, Warriors,1610612744, Lakers,1610612747
12/20/2017 Grizzlies at Warriors,0021700464,2017-18,2017-12-20, Warriors,1610612744, Grizzlies,1610612763
12/18/2017 Warriors at Lakers,0021700450,2017-18,2017-12-18, Lakers,1610612747, Warriors,1610612744
12/11/2017 Trail Blazers at Warriors,0021700395,2017-18,2017-12-11, Warriors,1610612744, Trail Blazers,1610612757
12/08/2017 Warriors at Pistons,0021700368,2017-18,2017-12-08, Pistons,1610612765, Warriors,1610612744
12/06/2017 Warriors at Hornets,0021700358,2017-18,2017-12-06, Hornets,1610612766, Warriors,1610612744
12/03/2017 Warriors at Heat,0021700335,2017-18,2017-12-03, Heat,1610612748, Warriors,1610612744
12/01/2017 Warriors at Magic,0021700318,2017-18,2017-12-01, Magic,1610612753, Warriors,1610612744
11/29/2017 Warriors at Lakers,0021700312,2017-18,2017-11-29, Lakers,1610612747, Warriors,1610612744
11/27/2017 Kings at Warriors,0021700296,2017-18,2017-11-27, Warriors,1610612744, Kings,1610612758
11/22/2017 Warriors at Thunder,0021700263,2017-18,2017-11-22, Thunder,1610612760, Warriors,1610612744
11/19/2017 Warriors at Nets,0021700236,2017-18,2017-11-19, Nets,1610612751, Warriors,1610612744
11/18/2017 Warriors at 76ers,0021700231,2017-18,2017-11-18, 76ers,1610612755, Warriors,1610612744
11/13/2017 Magic at Warriors,0021700199,2017-18,2017-11-13, Warriors,1610612744, Magic,1610612753
11/11/2017 76ers at Warriors,0021700184,2017-18,2017-11-11, Warriors,1610612744, 76ers,1610612755
11/08/2017 Timberwolves at Warriors,0021700163,2017-18,2017-11-08, Warriors,1610612744, Timberwolves,1610612750
11/06/2017 Heat at Warriors,0021700148,2017-18,2017-11-06, Warriors,1610612744, Heat,1610612748
11/02/2017 Warriors at Spurs,0021700117,2017-18,2017-11-02, Spurs,1610612759, Warriors,1610612744
10/30/2017 Warriors at Clippers,0021700100,2017-18,2017-10-30, Clippers,1610612746, Warriors,1610612744
10/29/2017 Pistons at Warriors,0021700091,2017-18,2017-10-29, Warriors,1610612744, Pistons,1610612765
10/27/2017 Wizards at Warriors,0021700075,2017-18,2017-10-27, Warriors,1610612744, Wizards,1610612764
10/25/2017 Raptors at Warriors,0021700063,2017-18,2017-10-25, Warriors,1610612744, Raptors,1610612761
10/21/2017 Warriors at Grizzlies,0021700033,2017-18,2017-10-21, Grizzlies,1610612763, Warriors,1610612744
10/17/2017 Rockets at Warriors,0021700002,2017-18,2017-10-17, Warriors,1610612744, Rockets,1610612745
04/11/2018 Rockets at Kings,0021701230,2017-18,2018-04-11, Kings,1610612758, Rockets,1610612745
04/10/2018 Rockets at Lakers,0021701218,2017-18,2018-04-10, Lakers,1610612747, Rockets,1610612745
04/07/2018 Thunder at Rockets,0021701194,2017-18,2018-04-07, Rockets,1610612745, Thunder,1610612760
04/05/2018 Trail Blazers at Rockets,0021701177,2017-18,2018-04-05, Rockets,1610612745, Trail Blazers,1610612757
04/03/2018 Wizards at Rockets,0021701161,2017-18,2018-04-03, Rockets,1610612745, Wizards,1610612764
04/01/2018 Rockets at Spurs,0021701145,2017-18,2018-04-01, Spurs,1610612759, Rockets,1610612745
03/30/2018 Suns at Rockets,0021701132,2017-18,2018-03-30, Rockets,1610612745, Suns,1610612756
03/22/2018 Pistons at Rockets,0021701074,2017-18,2018-03-22, Rockets,1610612745, Pistons,1610612765
03/20/2018 Rockets at Trail Blazers,0021701064,2017-18,2018-03-20, Trail Blazers,1610612757, Rockets,1610612745
03/18/2018 Rockets at Timberwolves,0021701048,2017-18,2018-03-18, Timberwolves,1610612750, Rockets,1610612745
03/15/2018 Clippers at Rockets,0021701023,2017-18,2018-03-15, Rockets,1610612745, Clippers,1610612746
03/12/2018 Spurs at Rockets,0021701001,2017-18,2018-03-12, Rockets,1610612745, Spurs,1610612759
03/09/2018 Rockets at Raptors,0021700979,2017-18,2018-03-09, Raptors,1610612761, Rockets,1610612745
03/07/2018 Rockets at Bucks,0021700968,2017-18,2018-03-07, Bucks,1610612749, Rockets,1610612745
03/06/2018 Rockets at Thunder,0021700960,2017-18,2018-03-06, Thunder,1610612760, Rockets,1610612745
02/28/2018 Rockets at Clippers,0021700921,2017-18,2018-02-28, Clippers,1610612746, Rockets,1610612745
02/26/2018 Rockets at Jazz,0021700905,2017-18,2018-02-26, Jazz,1610612762, Rockets,1610612745
02/23/2018 Timberwolves at Rockets,0021700877,2017-18,2018-02-23, Rockets,1610612745, Timberwolves,1610612750
02/14/2018 Kings at Rockets,0021700860,2017-18,2018-02-14, Rockets,1610612745, Kings,1610612758
02/13/2018 Rockets at Timberwolves,0021700849,2017-18,2018-02-13, Timberwolves,1610612750, Rockets,1610612745
02/07/2018 Rockets at Heat,0021700806,2017-18,2018-02-07, Heat,1610612748, Rockets,1610612745
02/06/2018 Rockets at Nets,0021700800,2017-18,2018-02-06, Nets,1610612751, Rockets,1610612745
02/01/2018 Rockets at Spurs,0021700764,2017-18,2018-02-01, Spurs,1610612759, Rockets,1610612745
01/30/2018 Magic at Rockets,0021700748,2017-18,2018-01-30, Rockets,1610612745, Magic,1610612753
01/28/2018 Suns at Rockets,0021700732,2017-18,2018-01-28, Rockets,1610612745, Suns,1610612756
01/22/2018 Heat at Rockets,0021700689,2017-18,2018-01-22, Rockets,1610612745, Heat,1610612748
01/18/2018 Timberwolves at Rockets,0021700665,2017-18,2018-01-18, Rockets,1610612745, Timberwolves,1610612750
01/15/2018 Rockets at Clippers,0021700648,2017-18,2018-01-15, Clippers,1610612746, Rockets,1610612745
01/12/2018 Rockets at Suns,0021700626,2017-18,2018-01-12, Suns,1610612756, Rockets,1610612745
01/10/2018 Trail Blazers at Rockets,0021700608,2017-18,2018-01-10, Rockets,1610612745, Trail Blazers,1610612757
01/06/2018 Rockets at Pistons,0021700580,2017-18,2018-01-06, Pistons,1610612765, Rockets,1610612745
01/03/2018 Rockets at Magic,0021700554,2017-18,2018-01-03, Magic,1610612753, Rockets,1610612745
12/31/2017 Lakers at Rockets,0021700540,2017-18,2017-12-31, Rockets,1610612745, Lakers,1610612747
12/29/2017 Rockets at Wizards,0021700521,2017-18,2017-12-29, Wizards,1610612764, Rockets,1610612745
12/25/2017 Rockets at Thunder,0021700496,2017-18,2017-12-25, Thunder,1610612760, Rockets,1610612745
12/22/2017 Clippers at Rockets,0021700475,2017-18,2017-12-22, Rockets,1610612745, Clippers,1610612746
12/20/2017 Lakers at Rockets,0021700459,2017-18,2017-12-20, Rockets,1610612745, Lakers,1610612747
12/18/2017 Jazz at Rockets,0021700445,2017-18,2017-12-18, Rockets,1610612745, Jazz,1610612762
12/16/2017 Bucks at Rockets,0021700433,2017-18,2017-12-16, Rockets,1610612745, Bucks,1610612749
12/15/2017 Spurs at Rockets,0021700428,2017-18,2017-12-15, Rockets,1610612745, Spurs,1610612759
12/13/2017 Hornets at Rockets,0021700412,2017-18,2017-12-13, Rockets,1610612745, Hornets,1610612766
12/09/2017 Rockets at Trail Blazers,0021700384,2017-18,2017-12-09, Trail Blazers,1610612757, Rockets,1610612745
12/07/2017 Rockets at Jazz,0021700366,2017-18,2017-12-07, Jazz,1610612762, Rockets,1610612745
12/03/2017 Rockets at Lakers,0021700338,2017-18,2017-12-03, Lakers,1610612747, Rockets,1610612745
11/29/2017 Pacers at Rockets,0021700308,2017-18,2017-11-29, Rockets,1610612745, Pacers,1610612754
11/27/2017 Nets at Rockets,0021700294,2017-18,2017-11-27, Rockets,1610612745, Nets,1610612751
11/25/2017 Knicks at Rockets,0021700282,2017-18,2017-11-25, Rockets,1610612745, Knicks,1610612752
11/18/2017 Rockets at Grizzlies,0021700232,2017-18,2017-11-18, Grizzlies,1610612763, Rockets,1610612745
11/16/2017 Rockets at Suns,0021700216,2017-18,2017-11-16, Suns,1610612756, Rockets,1610612745
11/14/2017 Raptors at Rockets,0021700202,2017-18,2017-11-14, Rockets,1610612745, Raptors,1610612761
11/12/2017 Rockets at Pacers,0021700190,2017-18,2017-11-12, Pacers,1610612754, Rockets,1610612745
11/11/2017 Grizzlies at Rockets,0021700180,2017-18,2017-11-11, Rockets,1610612745, Grizzlies,1610612763
11/05/2017 Jazz at Rockets,0021700140,2017-18,2017-11-05, Rockets,1610612745, Jazz,1610612762
11/01/2017 Rockets at Knicks,0021700111,2017-18,2017-11-01, Knicks,1610612752, Rockets,1610612745
10/30/2017 76ers at Rockets,0021700095,2017-18,2017-10-30, Rockets,1610612745, 76ers,1610612755
10/28/2017 Rockets at Grizzlies,0021700080,2017-18,2017-10-28, Grizzlies,1610612763, Rockets,1610612745
10/27/2017 Rockets at Hornets,0021700070,2017-18,2017-10-27, Hornets,1610612766, Rockets,1610612745
10/25/2017 Rockets at 76ers,0021700057,2017-18,2017-10-25, 76ers,1610612755, Rockets,1610612745
10/23/2017 Grizzlies at Rockets,0021700043,2017-18,2017-10-23, Rockets,1610612745, Grizzlies,1610612763
10/18/2017 Rockets at Kings,0021700013,2017-18,2017-10-18, Kings,1610612758, Rockets,1610612745
04/11/2018 Lakers at Clippers,0021701228,2017-18,2018-04-11, Clippers,1610612746, Lakers,1610612747
04/05/2018 Clippers at Jazz,0021701179,2017-18,2018-04-05, Jazz,1610612762, Clippers,1610612746
04/03/2018 Spurs at Clippers,0021701168,2017-18,2018-04-03, Clippers,1610612746, Spurs,1610612759
04/01/2018 Pacers at Clippers,0021701146,2017-18,2018-04-01, Clippers,1610612746, Pacers,1610612754
03/30/2018 Clippers at Trail Blazers,0021701137,2017-18,2018-03-30, Trail Blazers,1610612757, Clippers,1610612746
03/28/2018 Clippers at Suns,0021701122,2017-18,2018-03-28, Suns,1610612756, Clippers,1610612746
03/27/2018 Bucks at Clippers,0021701115,2017-18,2018-03-27, Clippers,1610612746, Bucks,1610612749
03/25/2018 Clippers at Raptors,0021701097,2017-18,2018-03-25, Raptors,1610612761, Clippers,1610612746
03/23/2018 Clippers at Pacers,0021701078,2017-18,2018-03-23, Pacers,1610612754, Clippers,1610612746
03/21/2018 Clippers at Bucks,0021701070,2017-18,2018-03-21, Bucks,1610612749, Clippers,1610612746
03/20/2018 Clippers at Timberwolves,0021701060,2017-18,2018-03-20, Timberwolves,1610612750, Clippers,1610612746
03/18/2018 Trail Blazers at Clippers,0021701049,2017-18,2018-03-18, Clippers,1610612746, Trail Blazers,1610612757
03/16/2018 Clippers at Thunder,0021701032,2017-18,2018-03-16, Thunder,1610612760, Clippers,1610612746
03/10/2018 Magic at Clippers,0021700991,2017-18,2018-03-10, Clippers,1610612746, Magic,1610612753
03/04/2018 Nets at Clippers,0021700948,2017-18,2018-03-04, Clippers,1610612746, Nets,1610612751
03/02/2018 Knicks at Clippers,0021700935,2017-18,2018-03-02, Clippers,1610612746, Knicks,1610612752
02/23/2018 Clippers at Suns,0021700881,2017-18,2018-02-23, Suns,1610612756, Clippers,1610612746
02/12/2018 Clippers at Nets,0021700843,2017-18,2018-02-12, Nets,1610612751, Clippers,1610612746
02/10/2018 Clippers at 76ers,0021700828,2017-18,2018-02-10, 76ers,1610612755, Clippers,1610612746
02/09/2018 Clippers at Pistons,0021700817,2017-18,2018-02-09, Pistons,1610612765, Clippers,1610612746
01/30/2018 Trail Blazers at Clippers,0021700752,2017-18,2018-01-30, Clippers,1610612746, Trail Blazers,1610612757
01/26/2018 Clippers at Grizzlies,0021700718,2017-18,2018-01-26, Grizzlies,1610612763, Clippers,1610612746
01/22/2018 Timberwolves at Clippers,0021700695,2017-18,2018-01-22, Clippers,1610612746, Timberwolves,1610612750
01/20/2018 Clippers at Jazz,0021700681,2017-18,2018-01-20, Jazz,1610612762, Clippers,1610612746
01/13/2018 Kings at Clippers,0021700628,2017-18,2018-01-13, Clippers,1610612746, Kings,1610612758
01/11/2018 Clippers at Kings,0021700616,2017-18,2018-01-11, Kings,1610612758, Clippers,1610612746
01/04/2018 Thunder at Clippers,0021700567,2017-18,2018-01-04, Clippers,1610612746, Thunder,1610612760
01/02/2018 Grizzlies at Clippers,0021700553,2017-18,2018-01-02, Clippers,1610612746, Grizzlies,1610612763
12/31/2017 Hornets at Clippers,0021700542,2017-18,2017-12-31, Clippers,1610612746, Hornets,1610612766
12/29/2017 Clippers at Lakers,0021700529,2017-18,2017-12-29, Lakers,1610612747, Clippers,1610612746
12/26/2017 Kings at Clippers,0021700505,2017-18,2017-12-26, Clippers,1610612746, Kings,1610612758
12/23/2017 Clippers at Grizzlies,0021700487,2017-18,2017-12-23, Grizzlies,1610612763, Clippers,1610612746
12/20/2017 Suns at Clippers,0021700465,2017-18,2017-12-20, Clippers,1610612746, Suns,1610612756
12/18/2017 Clippers at Spurs,0021700449,2017-18,2017-12-18, Spurs,1610612759, Clippers,1610612746
12/16/2017 Clippers at Heat,0021700432,2017-18,2017-12-16, Heat,1610612748, Clippers,1610612746
12/15/2017 Clippers at Wizards,0021700422,2017-18,2017-12-15, Wizards,1610612764, Clippers,1610612746
12/13/2017 Clippers at Magic,0021700405,2017-18,2017-12-13, Magic,1610612753, Clippers,1610612746
12/11/2017 Raptors at Clippers,0021700396,2017-18,2017-12-11, Clippers,1610612746, Raptors,1610612761
12/09/2017 Wizards at Clippers,0021700375,2017-18,2017-12-09, Clippers,1610612746, Wizards,1610612764
12/06/2017 Timberwolves at Clippers,0021700362,2017-18,2017-12-06, Clippers,1610612746, Timberwolves,1610612750
12/03/2017 Clippers at Timberwolves,0021700336,2017-18,2017-12-03, Timberwolves,1610612750, Clippers,1610612746
11/30/2017 Jazz at Clippers,0021700317,2017-18,2017-11-30, Clippers,1610612746, Jazz,1610612762
11/27/2017 Lakers at Clippers,0021700297,2017-18,2017-11-27, Clippers,1610612746, Lakers,1610612747
11/25/2017 Clippers at Kings,0021700286,2017-18,2017-11-25, Kings,1610612758, Clippers,1610612746
11/20/2017 Clippers at Knicks,0021700245,2017-18,2017-11-20, Knicks,1610612752, Clippers,1610612746
11/18/2017 Clippers at Hornets,0021700228,2017-18,2017-11-18, Hornets,1610612766, Clippers,1610612746
11/13/2017 76ers at Clippers,0021700200,2017-18,2017-11-13, Clippers,1610612746, 76ers,1610612755
11/10/2017 Clippers at Thunder,0021700172,2017-18,2017-11-10, Thunder,1610612760, Clippers,1610612746
11/07/2017 Clippers at Spurs,0021700154,2017-18,2017-11-07, Spurs,1610612759, Clippers,1610612746
11/05/2017 Heat at Clippers,0021700137,2017-18,2017-11-05, Clippers,1610612746, Heat,1610612748
11/04/2017 Grizzlies at Clippers,0021700131,2017-18,2017-11-04, Clippers,1610612746, Grizzlies,1610612763
10/28/2017 Pistons at Clippers,0021700084,2017-18,2017-10-28, Clippers,1610612746, Pistons,1610612765
10/26/2017 Clippers at Trail Blazers,0021700068,2017-18,2017-10-26, Trail Blazers,1610612757, Clippers,1610612746
10/24/2017 Jazz at Clippers,0021700054,2017-18,2017-10-24, Clippers,1610612746, Jazz,1610612762
10/21/2017 Suns at Clippers,0021700037,2017-18,2017-10-21, Clippers,1610612746, Suns,1610612756
10/19/2017 Clippers at Lakers,0021700016,2017-18,2017-10-19, Lakers,1610612747, Clippers,1610612746
04/08/2018 Jazz at Lakers,0021701201,2017-18,2018-04-08, Lakers,1610612747, Jazz,1610612762
04/06/2018 Timberwolves at Lakers,0021701190,2017-18,2018-04-06, Lakers,1610612747, Timberwolves,1610612750
04/04/2018 Spurs at Lakers,0021701174,2017-18,2018-04-04, Lakers,1610612747, Spurs,1610612759
04/03/2018 Lakers at Jazz,0021701166,2017-18,2018-04-03, Jazz,1610612762, Lakers,1610612747
04/01/2018 Kings at Lakers,0021701155,2017-18,2018-04-01, Lakers,1610612747, Kings,1610612758
03/30/2018 Bucks at Lakers,0021701136,2017-18,2018-03-30, Lakers,1610612747, Bucks,1610612749
03/26/2018 Lakers at Pistons,0021701104,2017-18,2018-03-26, Pistons,1610612765, Lakers,1610612747
03/24/2018 Lakers at Grizzlies,0021701092,2017-18,2018-03-24, Grizzlies,1610612763, Lakers,1610612747
03/19/2018 Lakers at Pacers,0021701051,2017-18,2018-03-19, Pacers,1610612754, Lakers,1610612747
03/16/2018 Heat at Lakers,0021701034,2017-18,2018-03-16, Lakers,1610612747, Heat,1610612748
03/07/2018 Magic at Lakers,0021700971,2017-18,2018-03-07, Lakers,1610612747, Magic,1610612753
03/05/2018 Trail Blazers at Lakers,0021700956,2017-18,2018-03-05, Lakers,1610612747, Trail Blazers,1610612757
03/03/2018 Lakers at Spurs,0021700940,2017-18,2018-03-03, Spurs,1610612759, Lakers,1610612747
03/01/2018 Lakers at Heat,0021700922,2017-18,2018-03-01, Heat,1610612748, Lakers,1610612747
02/24/2018 Lakers at Kings,0021700891,2017-18,2018-02-24, Kings,1610612758, Lakers,1610612747
02/15/2018 Lakers at Timberwolves,0021700866,2017-18,2018-02-15, Timberwolves,1610612750, Lakers,1610612747
02/08/2018 Thunder at Lakers,0021700816,2017-18,2018-02-08, Lakers,1610612747, Thunder,1610612760
02/06/2018 Suns at Lakers,0021700804,2017-18,2018-02-06, Lakers,1610612747, Suns,1610612756
02/04/2018 Lakers at Thunder,0021700788,2017-18,2018-02-04, Thunder,1610612760, Lakers,1610612747
02/02/2018 Lakers at Nets,0021700768,2017-18,2018-02-02, Nets,1610612751, Lakers,1610612747
01/31/2018 Lakers at Magic,0021700754,2017-18,2018-01-31, Magic,1610612753, Lakers,1610612747
01/28/2018 Lakers at Raptors,0021700735,2017-18,2018-01-28, Raptors,1610612761, Lakers,1610612747
01/21/2018 Knicks at Lakers,0021700684,2017-18,2018-01-21, Lakers,1610612747, Knicks,1610612752
01/19/2018 Pacers at Lakers,0021700673,2017-18,2018-01-19, Lakers,1610612747, Pacers,1610612754
01/17/2018 Lakers at Thunder,0021700660,2017-18,2018-01-17, Thunder,1610612760, Lakers,1610612747
01/15/2018 Lakers at Grizzlies,0021700645,2017-18,2018-01-15, Grizzlies,1610612763, Lakers,1610612747
01/11/2018 Spurs at Lakers,0021700617,2017-18,2018-01-11, Lakers,1610612747, Spurs,1610612759
01/09/2018 Kings at Lakers,0021700602,2017-18,2018-01-09, Lakers,1610612747, Kings,1610612758
01/05/2018 Hornets at Lakers,0021700577,2017-18,2018-01-05, Lakers,1610612747, Hornets,1610612766
01/03/2018 Thunder at Lakers,0021700565,2017-18,2018-01-03, Lakers,1610612747, Thunder,1610612760
01/01/2018 Lakers at Timberwolves,0021700548,2017-18,2018-01-01, Timberwolves,1610612750, Lakers,1610612747
12/27/2017 Grizzlies at Lakers,0021700515,2017-18,2017-12-27, Lakers,1610612747, Grizzlies,1610612763
12/25/2017 Timberwolves at Lakers,0021700497,2017-18,2017-12-25, Lakers,1610612747, Timberwolves,1610612750
12/23/2017 Trail Blazers at Lakers,0021700491,2017-18,2017-12-23, Lakers,1610612747, Trail Blazers,1610612757
12/12/2017 Lakers at Knicks,0021700399,2017-18,2017-12-12, Knicks,1610612752, Lakers,1610612747
12/09/2017 Lakers at Hornets,0021700377,2017-18,2017-12-09, Hornets,1610612766, Lakers,1610612747
12/07/2017 Lakers at 76ers,0021700363,2017-18,2017-12-07, 76ers,1610612755, Lakers,1610612747
11/22/2017 Lakers at Kings,0021700266,2017-18,2017-11-22, Kings,1610612758, Lakers,1610612747
11/17/2017 Suns at Lakers,0021700227,2017-18,2017-11-17, Lakers,1610612747, Suns,1610612756
11/15/2017 76ers at Lakers,0021700214,2017-18,2017-11-15, Lakers,1610612747, 76ers,1610612755
11/13/2017 Lakers at Suns,0021700196,2017-18,2017-11-13, Suns,1610612756, Lakers,1610612747
11/11/2017 Lakers at Bucks,0021700182,2017-18,2017-11-11, Bucks,1610612749, Lakers,1610612747
11/09/2017 Lakers at Wizards,0021700164,2017-18,2017-11-09, Wizards,1610612764, Lakers,1610612747
11/05/2017 Grizzlies at Lakers,0021700145,2017-18,2017-11-05, Lakers,1610612747, Grizzlies,1610612763
11/03/2017 Nets at Lakers,0021700130,2017-18,2017-11-03, Lakers,1610612747, Nets,1610612751
11/02/2017 Lakers at Trail Blazers,0021700118,2017-18,2017-11-02, Trail Blazers,1610612757, Lakers,1610612747
10/31/2017 Pistons at Lakers,0021700104,2017-18,2017-10-31, Lakers,1610612747, Pistons,1610612765
10/28/2017 Lakers at Jazz,0021700082,2017-18,2017-10-28, Jazz,1610612762, Lakers,1610612747
10/27/2017 Raptors at Lakers,0021700076,2017-18,2017-10-27, Lakers,1610612747, Raptors,1610612761
10/25/2017 Wizards at Lakers,0021700064,2017-18,2017-10-25, Lakers,1610612747, Wizards,1610612764
10/20/2017 Lakers at Suns,0021700026,2017-18,2017-10-20, Suns,1610612756, Lakers,1610612747
04/11/2018 Raptors at Heat,0021701221,2017-18,2018-04-11, Heat,1610612748, Raptors,1610612761
04/09/2018 Thunder at Heat,0021701206,2017-18,2018-04-09, Heat,1610612748, Thunder,1610612760
04/06/2018 Heat at Knicks,0021701186,2017-18,2018-04-06, Knicks,1610612752, Heat,1610612748
03/31/2018 Nets at Heat,0021701141,2017-18,2018-03-31, Heat,1610612748, Nets,1610612751
03/25/2018 Heat at Pacers,0021701096,2017-18,2018-03-25, Pacers,1610612754, Heat,1610612748
03/23/2018 Heat at Thunder,0021701084,2017-18,2018-03-23, Thunder,1610612760, Heat,1610612748
03/21/2018 Knicks at Heat,0021701068,2017-18,2018-03-21, Heat,1610612748, Knicks,1610612752
03/14/2018 Heat at Kings,0021701018,2017-18,2018-03-14, Kings,1610612758, Heat,1610612748
03/12/2018 Heat at Trail Blazers,0021701004,2017-18,2018-03-12, Trail Blazers,1610612757, Heat,1610612748
03/10/2018 Wizards at Heat,0021700988,2017-18,2018-03-10, Heat,1610612748, Wizards,1610612764
03/08/2018 76ers at Heat,0021700973,2017-18,2018-03-08, Heat,1610612748, 76ers,1610612755
03/06/2018 Heat at Wizards,0021700959,2017-18,2018-03-06, Wizards,1610612764, Heat,1610612748
03/05/2018 Suns at Heat,0021700952,2017-18,2018-03-05, Heat,1610612748, Suns,1610612756
03/03/2018 Pistons at Heat,0021700938,2017-18,2018-03-03, Heat,1610612748, Pistons,1610612765
02/27/2018 76ers at Heat,0021700909,2017-18,2018-02-27, Heat,1610612748, 76ers,1610612755
02/24/2018 Grizzlies at Heat,0021700885,2017-18,2018-02-24, Heat,1610612748, Grizzlies,1610612763
02/14/2018 Heat at 76ers,0021700855,2017-18,2018-02-14, 76ers,1610612755, Heat,1610612748
02/13/2018 Heat at Raptors,0021700847,2017-18,2018-02-13, Raptors,1610612761, Heat,1610612748
02/09/2018 Bucks at Heat,0021700821,2017-18,2018-02-09, Heat,1610612748, Bucks,1610612749
02/05/2018 Magic at Heat,0021700792,2017-18,2018-02-05, Heat,1610612748, Magic,1610612753
02/03/2018 Heat at Pistons,0021700776,2017-18,2018-02-03, Pistons,1610612765, Heat,1610612748
02/02/2018 Heat at 76ers,0021700770,2017-18,2018-02-02, 76ers,1610612755, Heat,1610612748
01/27/2018 Hornets at Heat,0021700727,2017-18,2018-01-27, Heat,1610612748, Hornets,1610612766
01/25/2018 Kings at Heat,0021700710,2017-18,2018-01-25, Heat,1610612748, Kings,1610612758
01/20/2018 Heat at Hornets,0021700676,2017-18,2018-01-20, Hornets,1610612766, Heat,1610612748
01/19/2018 Heat at Nets,0021700668,2017-18,2018-01-19, Nets,1610612751, Heat,1610612748
01/17/2018 Heat at Bucks,0021700659,2017-18,2018-01-17, Bucks,1610612749, Heat,1610612748
01/14/2018 Bucks at Heat,0021700634,2017-18,2018-01-14, Heat,1610612748, Bucks,1610612749
01/10/2018 Heat at Pacers,0021700604,2017-18,2018-01-10, Pacers,1610612754, Heat,1610612748
01/09/2018 Heat at Raptors,0021700599,2017-18,2018-01-09, Raptors,1610612761, Heat,1610612748
01/07/2018 Jazz at Heat,0021700586,2017-18,2018-01-07, Heat,1610612748, Jazz,1610612762
01/05/2018 Knicks at Heat,0021700568,2017-18,2018-01-05, Heat,1610612748, Knicks,1610612752
01/03/2018 Pistons at Heat,0021700558,2017-18,2018-01-03, Heat,1610612748, Pistons,1610612765
12/30/2017 Heat at Magic,0021700531,2017-18,2017-12-30, Magic,1610612753, Heat,1610612748
12/29/2017 Nets at Heat,0021700523,2017-18,2017-12-29, Heat,1610612748, Nets,1610612751
12/26/2017 Magic at Heat,0021700500,2017-18,2017-12-26, Heat,1610612748, Magic,1610612753
12/15/2017 Heat at Hornets,0021700418,2017-18,2017-12-15, Hornets,1610612766, Heat,1610612748
12/13/2017 Trail Blazers at Heat,0021700408,2017-18,2017-12-13, Heat,1610612748, Trail Blazers,1610612757
12/11/2017 Heat at Grizzlies,0021700393,2017-18,2017-12-11, Grizzlies,1610612763, Heat,1610612748
12/09/2017 Heat at Nets,0021700376,2017-18,2017-12-09, Nets,1610612751, Heat,1610612748
12/06/2017 Heat at Spurs,0021700361,2017-18,2017-12-06, Spurs,1610612759, Heat,1610612748
12/01/2017 Hornets at Heat,0021700321,2017-18,2017-12-01, Heat,1610612748, Hornets,1610612766
11/29/2017 Heat at Knicks,0021700306,2017-18,2017-11-29, Knicks,1610612752, Heat,1610612748
11/24/2017 Heat at Timberwolves,0021700272,2017-18,2017-11-24, Timberwolves,1610612750, Heat,1610612748
11/19/2017 Pacers at Heat,0021700235,2017-18,2017-11-19, Heat,1610612748, Pacers,1610612754
11/17/2017 Heat at Wizards,0021700218,2017-18,2017-11-17, Wizards,1610612764, Heat,1610612748
11/15/2017 Wizards at Heat,0021700205,2017-18,2017-11-15, Heat,1610612748, Wizards,1610612764
11/12/2017 Heat at Pistons,0021700189,2017-18,2017-11-12, Pistons,1610612765, Heat,1610612748
11/10/2017 Heat at Jazz,0021700175,2017-18,2017-11-10, Jazz,1610612762, Heat,1610612748
11/08/2017 Heat at Suns,0021700162,2017-18,2017-11-08, Suns,1610612756, Heat,1610612748
10/30/2017 Timberwolves at Heat,0021700093,2017-18,2017-10-30, Heat,1610612748, Timberwolves,1610612750
10/25/2017 Spurs at Heat,0021700059,2017-18,2017-10-25, Heat,1610612748, Spurs,1610612759
10/21/2017 Pacers at Heat,0021700029,2017-18,2017-10-21, Heat,1610612748, Pacers,1610612754
10/18/2017 Heat at Magic,0021700005,2017-18,2017-10-18, Magic,1610612753, Heat,1610612748
04/11/2018 Bucks at 76ers,0021701223,2017-18,2018-04-11, 76ers,1610612755, Bucks,1610612749
04/09/2018 Magic at Bucks,0021701208,2017-18,2018-04-09, Bucks,1610612749, Magic,1610612753
04/07/2018 Bucks at Knicks,0021701192,2017-18,2018-04-07, Knicks,1610612752, Bucks,1610612749
04/05/2018 Nets at Bucks,0021701178,2017-18,2018-04-05, Bucks,1610612749, Nets,1610612751
03/25/2018 Spurs at Bucks,0021701095,2017-18,2018-03-25, Bucks,1610612749, Spurs,1610612759
03/14/2018 Bucks at Magic,0021701016,2017-18,2018-03-14, Magic,1610612753, Bucks,1610612749
03/12/2018 Bucks at Grizzlies,0021701002,2017-18,2018-03-12, Grizzlies,1610612763, Bucks,1610612749
03/09/2018 Knicks at Bucks,0021700981,2017-18,2018-03-09, Bucks,1610612749, Knicks,1610612752
03/05/2018 Bucks at Pacers,0021700951,2017-18,2018-03-05, Pacers,1610612754, Bucks,1610612749
03/04/2018 76ers at Bucks,0021700947,2017-18,2018-03-04, Bucks,1610612749, 76ers,1610612755
03/02/2018 Pacers at Bucks,0021700932,2017-18,2018-03-02, Bucks,1610612749, Pacers,1610612754
02/28/2018 Bucks at Pistons,0021700913,2017-18,2018-02-28, Pistons,1610612765, Bucks,1610612749
02/27/2018 Wizards at Bucks,0021700910,2017-18,2018-02-27, Bucks,1610612749, Wizards,1610612764
02/23/2018 Bucks at Raptors,0021700876,2017-18,2018-02-23, Raptors,1610612761, Bucks,1610612749
02/10/2018 Bucks at Magic,0021700827,2017-18,2018-02-10, Magic,1610612753, Bucks,1610612749
02/06/2018 Bucks at Knicks,0021700801,2017-18,2018-02-06, Knicks,1610612752, Bucks,1610612749
02/04/2018 Bucks at Nets,0021700785,2017-18,2018-02-04, Nets,1610612751, Bucks,1610612749
02/02/2018 Knicks at Bucks,0021700771,2017-18,2018-02-02, Bucks,1610612749, Knicks,1610612752
02/01/2018 Bucks at Timberwolves,0021700763,2017-18,2018-02-01, Timberwolves,1610612750, Bucks,1610612749
01/29/2018 76ers at Bucks,0021700741,2017-18,2018-01-29, Bucks,1610612749, 76ers,1610612755
01/26/2018 Nets at Bucks,0021700719,2017-18,2018-01-26, Bucks,1610612749, Nets,1610612751
01/22/2018 Suns at Bucks,0021700691,2017-18,2018-01-22, Bucks,1610612749, Suns,1610612756
01/20/2018 Bucks at 76ers,0021700678,2017-18,2018-01-20, 76ers,1610612755, Bucks,1610612749
01/15/2018 Bucks at Wizards,0021700640,2017-18,2018-01-15, Wizards,1610612764, Bucks,1610612749
01/10/2018 Magic at Bucks,0021700610,2017-18,2018-01-10, Bucks,1610612749, Magic,1610612753
01/08/2018 Bucks at Pacers,0021700591,2017-18,2018-01-08, Pacers,1610612754, Bucks,1610612749
01/06/2018 Bucks at Wizards,0021700583,2017-18,2018-01-06, Wizards,1610612764, Bucks,1610612749
01/05/2018 Raptors at Bucks,0021700571,2017-18,2018-01-05, Bucks,1610612749, Raptors,1610612761
01/03/2018 Pacers at Bucks,0021700561,2017-18,2018-01-03, Bucks,1610612749, Pacers,1610612754
01/01/2018 Bucks at Raptors,0021700546,2017-18,2018-01-01, Raptors,1610612761, Bucks,1610612749
12/29/2017 Bucks at Thunder,0021700526,2017-18,2017-12-29, Thunder,1610612760, Bucks,1610612749
12/28/2017 Timberwolves at Bucks,0021700518,2017-18,2017-12-28, Bucks,1610612749, Timberwolves,1610612750
12/23/2017 Bucks at Hornets,0021700481,2017-18,2017-12-23, Hornets,1610612766, Bucks,1610612749
12/22/2017 Hornets at Bucks,0021700476,2017-18,2017-12-22, Bucks,1610612749, Hornets,1610612766
12/09/2017 Jazz at Bucks,0021700381,2017-18,2017-12-09, Bucks,1610612749, Jazz,1610612762
12/06/2017 Pistons at Bucks,0021700359,2017-18,2017-12-06, Bucks,1610612749, Pistons,1610612765
12/02/2017 Kings at Bucks,0021700331,2017-18,2017-12-02, Bucks,1610612749, Kings,1610612758
11/30/2017 Bucks at Trail Blazers,0021700316,2017-18,2017-11-30, Trail Blazers,1610612757, Bucks,1610612749
11/28/2017 Bucks at Kings,0021700302,2017-18,2017-11-28, Kings,1610612758, Bucks,1610612749
11/25/2017 Bucks at Jazz,0021700285,2017-18,2017-11-25, Jazz,1610612762, Bucks,1610612749
11/22/2017 Bucks at Suns,0021700264,2017-18,2017-11-22, Suns,1610612756, Bucks,1610612749
11/20/2017 Wizards at Bucks,0021700247,2017-18,2017-11-20, Bucks,1610612749, Wizards,1610612764
11/15/2017 Pistons at Bucks,0021700209,2017-18,2017-11-15, Bucks,1610612749, Pistons,1610612765
11/13/2017 Grizzlies at Bucks,0021700194,2017-18,2017-11-13, Bucks,1610612749, Grizzlies,1610612763
11/10/2017 Bucks at Spurs,0021700173,2017-18,2017-11-10, Spurs,1610612759, Bucks,1610612749
11/03/2017 Bucks at Pistons,0021700119,2017-18,2017-11-03, Pistons,1610612765, Bucks,1610612749
11/01/2017 Bucks at Hornets,0021700105,2017-18,2017-11-01, Hornets,1610612766, Bucks,1610612749
10/31/2017 Thunder at Bucks,0021700103,2017-18,2017-10-31, Bucks,1610612749, Thunder,1610612760
10/23/2017 Hornets at Bucks,0021700044,2017-18,2017-10-23, Bucks,1610612749, Hornets,1610612766
10/21/2017 Trail Blazers at Bucks,0021700034,2017-18,2017-10-21, Bucks,1610612749, Trail Blazers,1610612757
04/09/2018 Grizzlies at Timberwolves,0021701209,2017-18,2018-04-09, Timberwolves,1610612750, Grizzlies,1610612763
04/01/2018 Jazz at Timberwolves,0021701151,2017-18,2018-04-01, Timberwolves,1610612750, Jazz,1610612762
03/26/2018 Grizzlies at Timberwolves,0021701106,2017-18,2018-03-26, Timberwolves,1610612750, Grizzlies,1610612763
03/24/2018 Timberwolves at 76ers,0021701088,2017-18,2018-03-24, 76ers,1610612755, Timberwolves,1610612750
03/23/2018 Timberwolves at Knicks,0021701081,2017-18,2018-03-23, Knicks,1610612752, Timberwolves,1610612750
03/17/2018 Timberwolves at Spurs,0021701042,2017-18,2018-03-17, Spurs,1610612759, Timberwolves,1610612750
03/13/2018 Timberwolves at Wizards,0021701006,2017-18,2018-03-13, Wizards,1610612764, Timberwolves,1610612750
03/02/2018 Timberwolves at Jazz,0021700934,2017-18,2018-03-02, Jazz,1610612762, Timberwolves,1610612750
03/01/2018 Timberwolves at Trail Blazers,0021700925,2017-18,2018-03-01, Trail Blazers,1610612757, Timberwolves,1610612750
02/26/2018 Timberwolves at Kings,0021700906,2017-18,2018-02-26, Kings,1610612758, Timberwolves,1610612750
02/11/2018 Kings at Timberwolves,0021700838,2017-18,2018-02-11, Timberwolves,1610612750, Kings,1610612758
01/30/2018 Timberwolves at Raptors,0021700746,2017-18,2018-01-30, Raptors,1610612761, Timberwolves,1610612750
01/27/2018 Nets at Timberwolves,0021700729,2017-18,2018-01-27, Timberwolves,1610612750, Nets,1610612751
01/24/2018 Timberwolves at Trail Blazers,0021700708,2017-18,2018-01-24, Trail Blazers,1610612757, Timberwolves,1610612750
01/20/2018 Raptors at Timberwolves,0021700680,2017-18,2018-01-20, Timberwolves,1610612750, Raptors,1610612761
01/16/2018 Timberwolves at Magic,0021700649,2017-18,2018-01-16, Magic,1610612753, Timberwolves,1610612750
01/14/2018 Trail Blazers at Timberwolves,0021700637,2017-18,2018-01-14, Timberwolves,1610612750, Trail Blazers,1610612757
01/12/2018 Knicks at Timberwolves,0021700623,2017-18,2018-01-12, Timberwolves,1610612750, Knicks,1610612752
01/10/2018 Thunder at Timberwolves,0021700611,2017-18,2018-01-10, Timberwolves,1610612750, Thunder,1610612760
01/03/2018 Timberwolves at Nets,0021700557,2017-18,2018-01-03, Nets,1610612751, Timberwolves,1610612750
12/31/2017 Timberwolves at Pacers,0021700538,2017-18,2017-12-31, Pacers,1610612754, Timberwolves,1610612750
12/23/2017 Timberwolves at Suns,0021700490,2017-18,2017-12-23, Suns,1610612756, Timberwolves,1610612750
12/18/2017 Trail Blazers at Timberwolves,0021700446,2017-18,2017-12-18, Timberwolves,1610612750, Trail Blazers,1610612757
12/16/2017 Suns at Timberwolves,0021700434,2017-18,2017-12-16, Timberwolves,1610612750, Suns,1610612756
12/14/2017 Kings at Timberwolves,0021700416,2017-18,2017-12-14, Timberwolves,1610612750, Kings,1610612758
12/12/2017 76ers at Timberwolves,0021700401,2017-18,2017-12-12, Timberwolves,1610612750, 76ers,1610612755
12/04/2017 Timberwolves at Grizzlies,0021700345,2017-18,2017-12-04, Grizzlies,1610612763, Timberwolves,1610612750
12/01/2017 Timberwolves at Thunder,0021700324,2017-18,2017-12-01, Thunder,1610612760, Timberwolves,1610612750
11/28/2017 Wizards at Timberwolves,0021700300,2017-18,2017-11-28, Timberwolves,1610612750, Wizards,1610612764
11/26/2017 Suns at Timberwolves,0021700288,2017-18,2017-11-26, Timberwolves,1610612750, Suns,1610612756
11/22/2017 Magic at Timberwolves,0021700261,2017-18,2017-11-22, Timberwolves,1610612750, Magic,1610612753
11/20/2017 Timberwolves at Hornets,0021700241,2017-18,2017-11-20, Hornets,1610612766, Timberwolves,1610612750
11/19/2017 Pistons at Timberwolves,0021700238,2017-18,2017-11-19, Timberwolves,1610612750, Pistons,1610612765
11/15/2017 Spurs at Timberwolves,0021700210,2017-18,2017-11-15, Timberwolves,1610612750, Spurs,1610612759
11/13/2017 Timberwolves at Jazz,0021700197,2017-18,2017-11-13, Jazz,1610612762, Timberwolves,1610612750
11/11/2017 Timberwolves at Suns,0021700186,2017-18,2017-11-11, Suns,1610612756, Timberwolves,1610612750
11/05/2017 Hornets at Timberwolves,0021700143,2017-18,2017-11-05, Timberwolves,1610612750, Hornets,1610612766
10/27/2017 Thunder at Timberwolves,0021700074,2017-18,2017-10-27, Timberwolves,1610612750, Thunder,1610612760
10/25/2017 Timberwolves at Pistons,0021700056,2017-18,2017-10-25, Pistons,1610612765, Timberwolves,1610612750
10/24/2017 Pacers at Timberwolves,0021700052,2017-18,2017-10-24, Timberwolves,1610612750, Pacers,1610612754
10/22/2017 Timberwolves at Thunder,0021700039,2017-18,2017-10-22, Thunder,1610612760, Timberwolves,1610612750
10/20/2017 Jazz at Timberwolves,0021700023,2017-18,2017-10-20, Timberwolves,1610612750, Jazz,1610612762
10/18/2017 Timberwolves at Spurs,0021700011,2017-18,2017-10-18, Spurs,1610612759, Timberwolves,1610612750
04/03/2018 Nets at 76ers,0021701157,2017-18,2018-04-03, 76ers,1610612755, Nets,1610612751
04/01/2018 Pistons at Nets,0021701148,2017-18,2018-04-01, Nets,1610612751, Pistons,1610612765
03/28/2018 Nets at Magic,0021701117,2017-18,2018-03-28, Magic,1610612753, Nets,1610612751
03/23/2018 Nets at Raptors,0021701082,2017-18,2018-03-23, Raptors,1610612761, Nets,1610612751
03/21/2018 Hornets at Nets,0021701067,2017-18,2018-03-21, Nets,1610612751, Hornets,1610612766
03/19/2018 Grizzlies at Nets,0021701053,2017-18,2018-03-19, Nets,1610612751, Grizzlies,1610612763
03/16/2018 Nets at 76ers,0021701030,2017-18,2018-03-16, 76ers,1610612755, Nets,1610612751
03/13/2018 Raptors at Nets,0021701008,2017-18,2018-03-13, Nets,1610612751, Raptors,1610612761
03/11/2018 76ers at Nets,0021700999,2017-18,2018-03-11, Nets,1610612751, 76ers,1610612755
03/08/2018 Nets at Hornets,0021700972,2017-18,2018-03-08, Hornets,1610612766, Nets,1610612751
03/01/2018 Nets at Kings,0021700924,2017-18,2018-03-01, Kings,1610612758, Nets,1610612751
02/22/2018 Nets at Hornets,0021700867,2017-18,2018-02-22, Hornets,1610612766, Nets,1610612751
02/14/2018 Pacers at Nets,0021700856,2017-18,2018-02-14, Nets,1610612751, Pacers,1610612754
02/07/2018 Nets at Pistons,0021700805,2017-18,2018-02-07, Pistons,1610612765, Nets,1610612751
01/31/2018 76ers at Nets,0021700756,2017-18,2018-01-31, Nets,1610612751, 76ers,1610612755
01/30/2018 Nets at Knicks,0021700745,2017-18,2018-01-30, Knicks,1610612752, Nets,1610612751
01/23/2018 Nets at Thunder,0021700697,2017-18,2018-01-23, Thunder,1610612760, Nets,1610612751
01/21/2018 Nets at Pistons,0021700685,2017-18,2018-01-21, Pistons,1610612765, Nets,1610612751
01/17/2018 Spurs at Nets,0021700655,2017-18,2018-01-17, Nets,1610612751, Spurs,1610612759
01/15/2018 Knicks at Nets,0021700642,2017-18,2018-01-15, Nets,1610612751, Knicks,1610612752
01/13/2018 Nets at Wizards,0021700630,2017-18,2018-01-13, Wizards,1610612764, Nets,1610612751
01/10/2018 Pistons at Nets,0021700606,2017-18,2018-01-10, Nets,1610612751, Pistons,1610612765
01/08/2018 Raptors at Nets,0021700592,2017-18,2018-01-08, Nets,1610612751, Raptors,1610612761
01/01/2018 Magic at Nets,0021700545,2017-18,2018-01-01, Nets,1610612751, Magic,1610612753
12/26/2017 Nets at Spurs,0021700502,2017-18,2017-12-26, Spurs,1610612759, Nets,1610612751
12/23/2017 Nets at Pacers,0021700482,2017-18,2017-12-23, Pacers,1610612754, Nets,1610612751
12/22/2017 Wizards at Nets,0021700473,2017-18,2017-12-22, Nets,1610612751, Wizards,1610612764
12/20/2017 Kings at Nets,0021700457,2017-18,2017-12-20, Nets,1610612751, Kings,1610612758
12/17/2017 Pacers at Nets,0021700439,2017-18,2017-12-17, Nets,1610612751, Pacers,1610612754
12/15/2017 Nets at Raptors,0021700424,2017-18,2017-12-15, Raptors,1610612761, Nets,1610612751
12/14/2017 Knicks at Nets,0021700414,2017-18,2017-12-14, Nets,1610612751, Knicks,1610612752
12/12/2017 Wizards at Nets,0021700400,2017-18,2017-12-12, Nets,1610612751, Wizards,1610612764
12/07/2017 Thunder at Nets,0021700365,2017-18,2017-12-07, Nets,1610612751, Thunder,1610612760
11/26/2017 Nets at Grizzlies,0021700289,2017-18,2017-11-26, Grizzlies,1610612763, Nets,1610612751
11/24/2017 Trail Blazers at Nets,0021700267,2017-18,2017-11-24, Nets,1610612751, Trail Blazers,1610612757
11/17/2017 Jazz at Nets,0021700219,2017-18,2017-11-17, Nets,1610612751, Jazz,1610612762
11/11/2017 Nets at Jazz,0021700187,2017-18,2017-11-11, Jazz,1610612762, Nets,1610612751
11/10/2017 Nets at Trail Blazers,0021700176,2017-18,2017-11-10, Trail Blazers,1610612757, Nets,1610612751
11/06/2017 Nets at Suns,0021700147,2017-18,2017-11-06, Suns,1610612756, Nets,1610612751
10/31/2017 Suns at Nets,0021700102,2017-18,2017-10-31, Nets,1610612751, Suns,1610612756
10/27/2017 Nets at Knicks,0021700073,2017-18,2017-10-27, Knicks,1610612752, Nets,1610612751
10/24/2017 Nets at Magic,0021700050,2017-18,2017-10-24, Magic,1610612753, Nets,1610612751
10/20/2017 Magic at Nets,0021700022,2017-18,2017-10-20, Nets,1610612751, Magic,1610612753
10/18/2017 Nets at Pacers,0021700004,2017-18,2017-10-18, Pacers,1610612754, Nets,1610612751
04/03/2018 Magic at Knicks,0021701159,2017-18,2018-04-03, Knicks,1610612752, Magic,1610612753
03/31/2018 Pistons at Knicks,0021701139,2017-18,2018-03-31, Knicks,1610612752, Pistons,1610612765
03/28/2018 Knicks at 76ers,0021701118,2017-18,2018-03-28, 76ers,1610612755, Knicks,1610612752
03/26/2018 Knicks at Hornets,0021701103,2017-18,2018-03-26, Hornets,1610612766, Knicks,1610612752
03/25/2018 Knicks at Wizards,0021701098,2017-18,2018-03-25, Wizards,1610612764, Knicks,1610612752
03/17/2018 Hornets at Knicks,0021701038,2017-18,2018-03-17, Knicks,1610612752, Hornets,1610612766
03/15/2018 76ers at Knicks,0021701022,2017-18,2018-03-15, Knicks,1610612752, 76ers,1610612755
03/11/2018 Raptors at Knicks,0021700992,2017-18,2018-03-11, Knicks,1610612752, Raptors,1610612761
03/06/2018 Knicks at Trail Blazers,0021700962,2017-18,2018-03-06, Trail Blazers,1610612757, Knicks,1610612752
03/04/2018 Knicks at Kings,0021700949,2017-18,2018-03-04, Kings,1610612758, Knicks,1610612752
02/22/2018 Knicks at Magic,0021700868,2017-18,2018-02-22, Magic,1610612753, Knicks,1610612752
02/14/2018 Wizards at Knicks,0021700857,2017-18,2018-02-14, Knicks,1610612752, Wizards,1610612764
02/12/2018 Knicks at 76ers,0021700842,2017-18,2018-02-12, 76ers,1610612755, Knicks,1610612752
02/11/2018 Knicks at Pacers,0021700836,2017-18,2018-02-11, Pacers,1610612754, Knicks,1610612752
02/08/2018 Knicks at Raptors,0021700812,2017-18,2018-02-08, Raptors,1610612761, Knicks,1610612752
01/26/2018 Knicks at Suns,0021700723,2017-18,2018-01-26, Suns,1610612756, Knicks,1610612752
01/19/2018 Knicks at Jazz,0021700672,2017-18,2018-01-19, Jazz,1610612762, Knicks,1610612752
01/17/2018 Knicks at Grizzlies,0021700658,2017-18,2018-01-17, Grizzlies,1610612763, Knicks,1610612752
01/03/2018 Knicks at Wizards,0021700556,2017-18,2018-01-03, Wizards,1610612764, Knicks,1610612752
01/02/2018 Spurs at Knicks,0021700550,2017-18,2018-01-02, Knicks,1610612752, Spurs,1610612759
12/28/2017 Knicks at Spurs,0021700519,2017-18,2017-12-28, Spurs,1610612759, Knicks,1610612752
12/25/2017 76ers at Knicks,0021700493,2017-18,2017-12-25, Knicks,1610612752, 76ers,1610612755
12/22/2017 Knicks at Pistons,0021700471,2017-18,2017-12-22, Pistons,1610612765, Knicks,1610612752
12/18/2017 Knicks at Hornets,0021700441,2017-18,2017-12-18, Hornets,1610612766, Knicks,1610612752
12/16/2017 Thunder at Knicks,0021700431,2017-18,2017-12-16, Knicks,1610612752, Thunder,1610612760
12/06/2017 Grizzlies at Knicks,0021700357,2017-18,2017-12-06, Knicks,1610612752, Grizzlies,1610612763
12/04/2017 Knicks at Pacers,0021700340,2017-18,2017-12-04, Pacers,1610612754, Knicks,1610612752
12/03/2017 Magic at Knicks,0021700334,2017-18,2017-12-03, Knicks,1610612752, Magic,1610612753
11/27/2017 Trail Blazers at Knicks,0021700293,2017-18,2017-11-27, Knicks,1610612752, Trail Blazers,1610612757
11/22/2017 Raptors at Knicks,0021700258,2017-18,2017-11-22, Knicks,1610612752, Raptors,1610612761
11/17/2017 Knicks at Raptors,0021700221,2017-18,2017-11-17, Raptors,1610612761, Knicks,1610612752
11/15/2017 Jazz at Knicks,0021700206,2017-18,2017-11-15, Knicks,1610612752, Jazz,1610612762
11/11/2017 Kings at Knicks,0021700179,2017-18,2017-11-11, Knicks,1610612752, Kings,1610612758
11/08/2017 Knicks at Magic,0021700160,2017-18,2017-11-08, Magic,1610612753, Knicks,1610612752
11/07/2017 Hornets at Knicks,0021700152,2017-18,2017-11-07, Knicks,1610612752, Hornets,1610612766
11/05/2017 Pacers at Knicks,0021700142,2017-18,2017-11-05, Knicks,1610612752, Pacers,1610612754
11/03/2017 Suns at Knicks,0021700124,2017-18,2017-11-03, Knicks,1610612752, Suns,1610612756
10/21/2017 Pistons at Knicks,0021700030,2017-18,2017-10-21, Knicks,1610612752, Pistons,1610612765
10/19/2017 Knicks at Thunder,0021700015,2017-18,2017-10-19, Thunder,1610612760, Knicks,1610612752
04/11/2018 Wizards at Magic,0021701222,2017-18,2018-04-11, Magic,1610612753, Wizards,1610612764
04/08/2018 Magic at Raptors,0021701200,2017-18,2018-04-08, Raptors,1610612761, Magic,1610612753
04/06/2018 Hornets at Magic,0021701182,2017-18,2018-04-06, Magic,1610612753, Hornets,1610612766
03/24/2018 Suns at Magic,0021701090,2017-18,2018-03-24, Magic,1610612753, Suns,1610612756
03/22/2018 76ers at Magic,0021701073,2017-18,2018-03-22, Magic,1610612753, 76ers,1610612755
03/20/2018 Raptors at Magic,0021701058,2017-18,2018-03-20, Magic,1610612753, Raptors,1610612761
03/13/2018 Magic at Spurs,0021701012,2017-18,2018-03-13, Spurs,1610612759, Magic,1610612753
03/09/2018 Magic at Kings,0021700985,2017-18,2018-03-09, Kings,1610612758, Magic,1610612753
03/05/2018 Magic at Jazz,0021700955,2017-18,2018-03-05, Jazz,1610612762, Magic,1610612753
03/03/2018 Grizzlies at Magic,0021700936,2017-18,2018-03-03, Magic,1610612753, Grizzlies,1610612763
03/02/2018 Pistons at Magic,0021700926,2017-18,2018-03-02, Magic,1610612753, Pistons,1610612765
02/28/2018 Raptors at Magic,0021700914,2017-18,2018-02-28, Magic,1610612753, Raptors,1610612761
02/26/2018 Magic at Thunder,0021700903,2017-18,2018-02-26, Thunder,1610612760, Magic,1610612753
02/24/2018 Magic at 76ers,0021700884,2017-18,2018-02-24, 76ers,1610612755, Magic,1610612753
02/14/2018 Hornets at Magic,0021700854,2017-18,2018-02-14, Magic,1610612753, Hornets,1610612766
02/03/2018 Wizards at Magic,0021700778,2017-18,2018-02-03, Magic,1610612753, Wizards,1610612764
01/27/2018 Magic at Pacers,0021700725,2017-18,2018-01-27, Pacers,1610612754, Magic,1610612753
01/23/2018 Kings at Magic,0021700696,2017-18,2018-01-23, Magic,1610612753, Kings,1610612758
01/12/2018 Magic at Wizards,0021700620,2017-18,2018-01-12, Wizards,1610612764, Magic,1610612753
12/28/2017 Pistons at Magic,0021700516,2017-18,2017-12-28, Magic,1610612753, Pistons,1610612765
12/23/2017 Magic at Wizards,0021700483,2017-18,2017-12-23, Wizards,1610612764, Magic,1610612753
12/17/2017 Magic at Pistons,0021700438,2017-18,2017-12-17, Pistons,1610612765, Magic,1610612753
12/15/2017 Trail Blazers at Magic,0021700420,2017-18,2017-12-15, Magic,1610612753, Trail Blazers,1610612757
12/04/2017 Magic at Hornets,0021700339,2017-18,2017-12-04, Hornets,1610612766, Magic,1610612753
11/29/2017 Thunder at Magic,0021700304,2017-18,2017-11-29, Magic,1610612753, Thunder,1610612760
11/27/2017 Magic at Pacers,0021700290,2017-18,2017-11-27, Pacers,1610612754, Magic,1610612753
11/25/2017 Magic at 76ers,0021700278,2017-18,2017-11-25, 76ers,1610612755, Magic,1610612753
11/20/2017 Pacers at Magic,0021700243,2017-18,2017-11-20, Magic,1610612753, Pacers,1610612754
11/18/2017 Jazz at Magic,0021700229,2017-18,2017-11-18, Magic,1610612753, Jazz,1610612762
11/15/2017 Magic at Trail Blazers,0021700213,2017-18,2017-11-15, Trail Blazers,1610612757, Magic,1610612753
11/10/2017 Magic at Suns,0021700174,2017-18,2017-11-10, Suns,1610612756, Magic,1610612753
11/01/2017 Magic at Grizzlies,0021700112,2017-18,2017-11-01, Grizzlies,1610612763, Magic,1610612753
10/29/2017 Magic at Hornets,0021700088,2017-18,2017-10-29, Hornets,1610612766, Magic,1610612753
10/27/2017 Spurs at Magic,0021700071,2017-18,2017-10-27, Magic,1610612753, Spurs,1610612759
